platform,id,key,name,rating,user_numbers,creator,last_updated,introduction,record_time
chrome,fhbohimaelbohpjbbldcngcnapndodjp,binance-chain-wallet,Binance Chain Wallet,2.5974025974025974,"200,000",Binance Chain,2021-02-25 00:00:00,"A Crypto Wallet for Binance Chain, Binance Smart Chain and Ethereum",2021-02-27 15:51:20.936648
chrome,ainmgbleakflfgjjoolgmgfepddnpeln,ethereum-monitor,Ethereum monitor,0.0,16,Awork,2020-07-15 00:00:00,Everything about Ethereum in one extension,2021-02-27 15:51:23.974861
chrome,eachlnokbkckmbhglohpcmhllebcdbme,ethereum-price-ticker-ale,Ethereum Price Ticker & Alert,0.0,27,happy elephant web development,2020-09-08 00:00:00,Show the Ethereum ticker price and set an alert so that the browser icon will flash when the alert price is passed.,2021-02-27 15:51:25.292067
chrome,nganaoejibmmoecajmpimkgmbkhfmhoj,fireth,Fireth,5.0,592,ETHSagan,2020-09-23 00:00:00,The most efficient Ethereum GAS price tracker,2021-02-27 15:51:27.557105
chrome,dconegbmnkoeccohdkifggkgdhoaedgc,ethereum-ethusd-price-tic,Ethereum (ETH/USD) Price Ticker,5.0,139,Taha,2020-03-20 00:00:00,This extension shows latest price of ETH in USD.,2021-02-27 15:51:28.553661
chrome,dlnalaneihafdkdcekejdekiclgdghka,breadcrumbs-blockchain-in,Breadcrumbs Blockchain Investigate,5.0,20,Breadcrumbs,2020-08-22 00:00:00,Tired of tracking of Ethereum addresses with an excel spreadsheet?  Wasting time loading webpages to follow an Ethereum whale?…,2021-02-27 15:51:29.310781
chrome,caddnmdigajdehmjbnlkpmnckkcneckf,ethereum-price-in-usd-by,Ethereum price in USD by BitcoinFan,5.0,34,BitcoinFan,2020-12-26 00:00:00,"This extension displays the current Ethereum price in USD on the badge. If you click it, a chart of the last 24h will be displayed.",2021-02-27 15:51:29.803741
chrome,nkddgncdjgjfcddamfgcmfnlhccnimig,saturn-wallet,Saturn Wallet,4.647058823529412,"2,000",Saturn Network,2020-01-29 00:00:00,Ethereum Browser Extension,2021-02-27 15:51:30.283602
chrome,blnieiiffboillknjnepogjhkgnoapac,equal-wallet,EQUAL Wallet,4.732142857142857,"1,000",equalnetwork,2021-01-05 00:00:00,EQUAL Wallet,2021-02-27 15:51:30.803639
chrome,afgfdkloegmghldbalmenklokhlifphe,defi-saver-gas-prices-ext,DeFi Saver Gas Prices Extension,4.777777777777778,"1,000",DeFi Saver,2021-01-18 00:00:00,Ethereum gas prices extension with dark and light modes and 7-day historical data.,2021-02-27 15:51:31.663413
chrome,lacghifpplnkgbelccecflapgnknmnci,ethereum-gas-watcher,Ethereum Gas Watcher,0.0,13,matnad,2021-02-01 00:00:00,Monitor Ethereum Gas Prices and set notifications,2021-02-27 15:51:33.336746
chrome,gmmnjkphjfnanlojihefoeidjmbakfde,ethereum-price-in-eur-by,Ethereum price in EUR by BitcoinFan,5.0,18,BitcoinFan,2020-12-26 00:00:00,"This extension displays the current Ethereum price in EUR on the badge. If you click it, a chart of the last 24h will be displayed.",2021-02-27 15:51:35.174774
chrome,fbbckponafgkennhnmgfoikfmbkiplgp,coinstats-crypto-portfoli,CoinStats - Crypto Portfolio Tracker,4.631578947368421,"7,000",Coin Stats Inc,2020-10-09 00:00:00,Cryptocurrency live price and portfolio tracker.,2021-02-27 15:51:39.363919
chrome,hipgfnjghjmfdebgmenoipheomjheknn,decamask,DECAMask,5.0,96,DECA,2020-07-04 00:00:00,An Ethereum Wallet in your Browser,2021-02-27 15:51:41.315734
chrome,japgcbmdokcibjdencjalgfjeglgbcgc,tx-ray-beta-protect-your,TX-ray (Beta): Protect Your Wallets,5.0,17,TX-ray,2020-03-19 00:00:00,"🔒The easiest, fastest way to protect your Ethereum wallet.",2021-02-27 15:51:42.324643
chrome,ejeemacpidnaejkhpbmfkadhgjhnolaa,ezdefi,ezDeFi,4.923076923076923,"2,000",ezdefi.com,2021-02-20 00:00:00,A Blockchain Wallet in your Browser,2021-02-27 15:51:42.785843
chrome,fhhkkooikehnkaodebbfnkinedlllcfk,blockchair,Blockchair,5.0,"2,000",Blockchair,2021-01-18 00:00:00,"Block explorer and anonymous crypto portfolio tracker for Bitcoin, Ethereum, and others in your browser",2021-02-27 15:51:43.295389
chrome,obhemlghbbloobahdlkjmniichcandhd,простой-конвертер-валют,Простой конвертер валют,4.2105263157894735,"1,000",MaxPax,2020-06-10 00:00:00,"Калькулятор курсов для валют: доллары, рубли, гривны, белорусские рубли, евро, польские злотые, BitCoin, Ethereum, Zcash, Litecoin",2021-02-27 15:51:45.689871
chrome,fgkldlaelopgncepgpncndebgdddikii,julwallet,JulWallet,5.0,824,JustLiquidity,2021-02-18 00:00:00,A MultiWallet in your Browser,2021-02-27 15:51:47.051861
chrome,jlbkpppjbkmkjjemjcofmccodofkknmc,cryptocurrency-prices-cha,Cryptocurrency Prices & Charts - BitDuck,5.0,604,CrisValls,2021-02-25 00:00:00,"Displays real-time prices and charts of different cryptocurrencies at 1 click, including from the browser bar.",2021-02-27 15:51:49.359970
chrome,cmbagcoinhmacpcgmbiniijboejgiahi,justliquidity-wallet,JustLiquidity Wallet,5.0,380,JustLiquidity,2020-10-13 00:00:00,Ethereum Browser Extension,2021-02-27 15:51:51.164887
chrome,mnlfoooikhmcaomegmfopecjngldnmmn,ethermine-watcher,Ethermine Watcher,0.0,393,DW Crypto,2020-05-19 00:00:00,"Watch your Ethermine hashrate, balance, ETA until payout and more.",2021-02-27 15:51:52.205017
chrome,ccnipbjnnkophfgnkmhdongajmkhijbl,gasnow-eth-gasprice-forec,GasNow - ETH GasPrice forecast system,5.0,230,GasNow.org,2021-02-23 00:00:00,The coolest tool to estimate the gas price of Ethereum,2021-02-27 15:51:54.166675
chrome,dgafljegcabiiplpjmfcepmndcabcgpm,just-ethereum-ticker-pro,Just Ethereum Ticker [PRO],0.0,3,morocco,2020-11-05 00:00:00,Super lightweight minimalist extension that displays the current Ethereum price in USD.,2021-02-27 15:51:56.017901
chrome,gegmganblgchemddleocdoadmljledcj,neuma,Neuma,5.0,257,IOV SAS,2020-09-08 00:00:00,"Key manager and transaction signer for the IOV, Ethereum and Lisk blockchains",2021-02-27 15:51:57.268000
chrome,bjfnbiebjhlnpjjalelblpfhojmcdahb,metatransact-dappconnect,MetaTransact dAppConnect,0.0,18,MetaTransact,2020-06-03 00:00:00,MetaTransact dAppConnect allow users to pay Ethereum txn fee in ERC20 tokens,2021-02-27 15:51:57.923000
chrome,kkilomkmpmkbdnfelcpgckmpcaemjcdh,celoextensionwallet,CeloExtensionWallet,0.0,107,jiyun.kim,2021-02-23 00:00:00,A Celo Extension Wallet in your Browser,2021-02-27 15:52:00.544709
chrome,jpfolalfhhpgehgboellpeohdaggocli,hex-metatransact-dappconn,HEX MetaTransact dAppConnect,0.0,10,MetaTransact,2020-05-31 00:00:00,HEX MetaTransact dAppConnect allow users to pay Ethereum txn fee in ERC20 tokens,2021-02-27 15:52:01.049363
chrome,hdkoeaaegcmoljdaegapdpabifhjkgci,binance,Binance,1.0,61,Binance,2021-01-05 00:00:00,Binance Wallet,2021-02-27 15:52:05.051416
chrome,ogajfoicbmjoggcpkmhddokjoipjbnkg,feel-the-fee,Feel the Fee,0.0,54,harry830622,2020-09-10 00:00:00,Check out real-time gas fees on Ethereum in whatever currency you like,2021-02-27 15:52:06.722045
chrome,pdpahdgmbnpeepflkedmdcieohpcpchh,cryptocurrency-price-tick,Cryptocurrency Price Ticker,5.0,35,Ethan Chiasson,2020-02-01 00:00:00,"This extension displays the live price of Bitcoin, Litecoin, and Ethereum",2021-02-27 15:52:09.542631
chrome,llpbjcejemjfaicajiephoejjnogfbed,bitcoin-tab,Bitcoin Tab,0.0,34,Bitcoin Tab,2020-11-29 00:00:00,Replace new tab page with a crypto dashboard,2021-02-27 15:52:10.056878
chrome,ldjaieegladfnkopenlafecgcdkealec,metatransact-dappconnect,MetaTransact dAppConnect,0.0,5,MetaTransact,2020-05-31 00:00:00,MetaTransact dAppConnect allow users to pay Ethereum txn fee in ERC20 tokens,2021-02-27 15:52:10.555470
chrome,gfchpofllbnjfhgmjbgmhljdpolcjing,mraddon-blockchain-viewer,MrAddon BlockChain Viewer for Chrome,0.0,24,MrAddon ®,2020-11-24 00:00:00,"MrAddon BlockChain Viewer for Chrome. Control the prices of Bitcoin, Ethereum, Litecoin, tokens etc all time",2021-02-27 15:52:11.026386
chrome,njnbpngnahedeekpedjkbaeihhihlbko,ethassistant,ETHAssistant,0.0,20,jeffrey.stone2020,2020-05-11 00:00:00,Helper for сomfortable working with Ethereum addresses in any websites and unique antiphishing utils for crypto enthusiasts.,2021-02-27 15:52:12.087755
chrome,ffkicalblogbdapjfckabempifkaieia,cryptocurrency-rates,Cryptocurrency Rates,4.0,16,Psych,2020-02-01 00:00:00,Constantly checks the rates of any cryptocurrency of your choice,2021-02-27 15:52:12.763936
chrome,cjelfplplebdjjenllpjcblmjkfcffne,jaxx-liberty,Jaxx Liberty,4.027027027027027,"30,000",Decentral Inc.,2021-02-01 00:00:00,Unifying the Blockchain Wallet experience across devices.,2021-02-27 15:52:17.184891
chrome,jbdaocneiiinmjbjlgalhcelgbejmnid,nifty-wallet,Nifty Wallet,4.782608695652174,"5,000",POA Network,2021-01-17 00:00:00,Ethereum Browser Extension,2021-02-27 15:52:20.508409
chrome,hpglfhgfnhbgpjdenjgmdgoeiappafln,guarda,Guarda,4.0,"3,000",Guarda,2020-12-29 00:00:00,Browser extension for Ethereum and any blockchain,2021-02-27 15:52:21.092541
chrome,nkddgncdjgjfcddamfgcmfnlhccnimig,saturn-wallet,Saturn Wallet,4.647058823529412,"2,000",Saturn Network,2020-01-29 00:00:00,Ethereum Browser Extension,2021-02-27 15:52:22.479954
chrome,mnlfoooikhmcaomegmfopecjngldnmmn,ethermine-watcher,Ethermine Watcher,0.0,393,DW Crypto,2020-05-19 00:00:00,"Watch your Ethermine hashrate, balance, ETA until payout and more.",2021-02-27 15:52:23.517022
chrome,ejeemcbjgjnbmdckfkiofpiogmkejdja,just-ethereum-classic-tic,Just Ethereum Classic Ticker [PRO],0.0,1,morocco,2020-11-03 00:00:00,"Super lightweight minimalist extension that displays the current Ethereum Classic price in USD.

Data pulled from Coingecko's v3…",2021-02-27 15:52:25.912755
chrome,ffkicalblogbdapjfckabempifkaieia,cryptocurrency-rates,Cryptocurrency Rates,4.0,16,Psych,2020-02-01 00:00:00,Constantly checks the rates of any cryptocurrency of your choice,2021-02-27 15:52:27.916249
chrome,bcnchpdbjajimfokaipiekoanbnhmdij,btcbit,BTCBIT,0.0,2,paulblair931,2020-02-19 00:00:00,"BTCBIT.NET - это качественный и надежный обменник криптовалют, базирующийся в Польше, с операционными офисами в Латвии и Эстонии.…",2021-02-27 15:52:29.119258
chrome,jbdaocneiiinmjbjlgalhcelgbejmnid,nifty-wallet,Nifty Wallet,4.782608695652174,"5,000",POA Network,2021-01-17 00:00:00,Ethereum Browser Extension,2021-02-27 15:52:31.624679
chrome,hpglfhgfnhbgpjdenjgmdgoeiappafln,guarda,Guarda,4.0,"3,000",Guarda,2020-12-29 00:00:00,Browser extension for Ethereum and any blockchain,2021-02-27 15:52:32.162024
chrome,nkddgncdjgjfcddamfgcmfnlhccnimig,saturn-wallet,Saturn Wallet,4.647058823529412,"2,000",Saturn Network,2020-01-29 00:00:00,Ethereum Browser Extension,2021-02-27 15:52:33.507009
chrome,mnlfoooikhmcaomegmfopecjngldnmmn,ethermine-watcher,Ethermine Watcher,0.0,393,DW Crypto,2020-05-19 00:00:00,"Watch your Ethermine hashrate, balance, ETA until payout and more.",2021-02-27 15:52:35.515168
chrome,ejeemcbjgjnbmdckfkiofpiogmkejdja,just-ethereum-classic-tic,Just Ethereum Classic Ticker [PRO],0.0,1,morocco,2020-11-03 00:00:00,"Super lightweight minimalist extension that displays the current Ethereum Classic price in USD.

Data pulled from Coingecko's v3…",2021-02-27 15:52:36.017913
chrome,ffkicalblogbdapjfckabempifkaieia,cryptocurrency-rates,Cryptocurrency Rates,4.0,16,Psych,2020-02-01 00:00:00,Constantly checks the rates of any cryptocurrency of your choice,2021-02-27 15:52:39.477247
chrome,bcnchpdbjajimfokaipiekoanbnhmdij,btcbit,BTCBIT,0.0,2,paulblair931,2020-02-19 00:00:00,"BTCBIT.NET - это качественный и надежный обменник криптовалют, базирующийся в Польше, с операционными офисами в Латвии и Эстонии.…",2021-02-27 15:52:41.057353
chrome,japgcbmdokcibjdencjalgfjeglgbcgc,tx-ray-beta-protect-your,TX-ray (Beta): Protect Your Wallets,5.0,17,TX-ray,2020-03-19 00:00:00,"🔒The easiest, fastest way to protect your Ethereum wallet.",2021-02-27 15:52:42.550410
chrome,hipgfnjghjmfdebgmenoipheomjheknn,decamask,DECAMask,5.0,96,DECA,2020-07-04 00:00:00,An Ethereum Wallet in your Browser,2021-02-27 15:52:43.042603
chrome,nkbihfbeogaeaoehlefnkodbefgpgknn,metamask,MetaMask,3.855213398163155,"2,000",metamask,2021-02-10 00:00:00,An Ethereum Wallet in your Browser,2021-02-27 15:52:43.730162
chrome,jbdaocneiiinmjbjlgalhcelgbejmnid,nifty-wallet,Nifty Wallet,4.782608695652174,"5,000",POA Network,2021-01-17 00:00:00,Ethereum Browser Extension,2021-02-27 15:52:44.759676
chrome,blnieiiffboillknjnepogjhkgnoapac,equal-wallet,EQUAL Wallet,4.732142857142857,"1,000",equalnetwork,2021-01-05 00:00:00,EQUAL Wallet,2021-02-27 15:52:45.769795
chrome,fgkldlaelopgncepgpncndebgdddikii,julwallet,JulWallet,5.0,824,JustLiquidity,2021-02-18 00:00:00,A MultiWallet in your Browser,2021-02-27 15:52:46.280463
chrome,kkilomkmpmkbdnfelcpgckmpcaemjcdh,celoextensionwallet,CeloExtensionWallet,0.0,107,jiyun.kim,2021-02-23 00:00:00,A Celo Extension Wallet in your Browser,2021-02-27 15:52:47.995820
chrome,dmoidpfmmhnchjngdjcbkpdjfmhkpnjg,burnerx,BurnerX,0.0,6,David Mihal,2020-08-28 00:00:00,"BurnerX is a Ethereum wallet and Web3 browser extension, built using the Burner Wallet 2 libraries.

BurnerX allows users to send &…",2021-02-27 15:52:50.820252
chrome,mnihbccealdipnmhjgilibljlolhbbka,metamask-for-cobo-vault,MetaMask For Cobo Vault,0.0,2,Cobo Vault,2021-02-23 00:00:00,An Ethereum Wallet in your Browser,2021-02-27 15:52:51.330316
chrome,ihdpgdlddojmmkaokmnfdcdlooialppg,sagewallet,SageWallet,0.0,1,sagecitydevs,2020-09-04 00:00:00,An Ethereum Wallet in your Browser,2021-02-27 15:52:52.669066
chrome,hpglfhgfnhbgpjdenjgmdgoeiappafln,guarda,Guarda,4.0,"3,000",Guarda,2020-12-29 00:00:00,Browser extension for Ethereum and any blockchain,2021-02-27 15:52:54.344332
chrome,ifpkfkehopifpgccncppdicimhcimccj,motocross-xtreme-stunts,Motocross Xtreme Stunts,0.0,"20,000",wellner.shenna1830,2020-05-04 00:00:00,In this motocross game you need to pass all nine levels and to earn points. Collect coins and do some stunts for extra points. Bal,2021-02-27 15:53:26.819440
chrome,mebalpjlaipopoeiekhmfkmoifpkfaki,fetchai-web-wallet,Fetch.ai Web Wallet,0.0,56,Fetch.AI,2020-04-24 00:00:00,The Fetch.ai Web Wallet is a Chrome Extension for making interactions with the Fetch.ai Ledger super easy,2021-02-27 15:53:34.720868
chrome,hkckdnfadmnkgmkojfhdihollnjhlaam,smartify-price-comparison,Smartify: Price comparison & Coupon codes,5.0,239,Smartify: Price comparison & Coupon codes,2021-02-26 00:00:00,Saves you money and time when you shop online,2021-02-27 15:53:50.591436
chrome,kjncpaiejgkgpgiiibmnjnkahokdgfap,memorai-–-ai-memory-assis,Memorai – AI memory assistant for Anki,4.125,636,humanloop,2021-01-24 00:00:00,AI memory assistant for Anki – remember everything you read by automatically generating question cards from text.,2021-02-27 15:54:03.574741
chrome,oaleidlaomjgnhfhpihkohgihgdcibmj,lowtels-chrome-extension,LowTels Chrome Extension V2.0,4.5,10,Wholesale Hotels Group,2020-09-03 00:00:00,www.Low-Tels.com provides one of the lowest travel industry rates on hotels and also provides the MOST REWARDING HOTEL CASH-BACK…,2021-02-27 15:54:55.724707
chrome,cdkfohddmakcgfajhnacobhdgddahlap,cryptocurrency-news-tab,Cryptocurrency News Tab,5.0,82,newstab.com,2021-02-08 00:00:00,Get top Cryptocurrency news on your Chrome new tab page. Add any topic or news source.,2021-02-27 15:55:01.902528
chrome,ifpkfkehopifpgccncppdicimhcimccj,motocross-xtreme-stunts,Motocross Xtreme Stunts,0.0,"20,000",wellner.shenna1830,2020-05-04 00:00:00,In this motocross game you need to pass all nine levels and to earn points. Collect coins and do some stunts for extra points. Bal,2021-02-27 15:55:15.633968
chrome,innfmlnnhfcebjcnfopadflecemoddnp,ethereum-gas-price-extens,Ethereum Gas Price Extension,4.818181818181818,"9,000",nieldlr,2020-11-04 00:00:00,Displays the current gas price using your preferred gas price provider.,2021-02-27 15:57:05.321669
chrome,afgfdkloegmghldbalmenklokhlifphe,defi-saver-gas-prices-ext,DeFi Saver Gas Prices Extension,4.777777777777778,"1,000",DeFi Saver,2021-01-18 00:00:00,Ethereum gas prices extension with dark and light modes and 7-day historical data.,2021-02-27 15:57:06.651254
chrome,lfjcgcmkmjjlieihflfhjopckgpelofo,google-apps-script-github,Google Apps Script GitHub Assistant,4.794871794871795,"10,000",leonhartX,2021-01-21 00:00:00,Manage your gas code with github/github enterprise/bitbucket/gitlab,2021-02-27 15:57:07.135336
chrome,njbclohenpagagafbmdipcdoogfpnfhp,ethereum-gas-prices,Ethereum Gas Prices,5.0,876,Philippe Masset,2021-02-26 00:00:00,"Ethereum gas price info, always up to date, from multiple sources",2021-02-27 15:57:07.660212
chrome,nganaoejibmmoecajmpimkgmbkhfmhoj,fireth,Fireth,5.0,592,ETHSagan,2020-09-23 00:00:00,The most efficient Ethereum GAS price tracker,2021-02-27 15:57:10.145981
chrome,ccnipbjnnkophfgnkmhdongajmkhijbl,gasnow-eth-gasprice-forec,GasNow - ETH GasPrice forecast system,5.0,230,GasNow.org,2021-02-23 00:00:00,The coolest tool to estimate the gas price of Ethereum,2021-02-27 15:57:14.334459
chrome,lacghifpplnkgbelccecflapgnknmnci,ethereum-gas-watcher,Ethereum Gas Watcher,0.0,13,matnad,2021-02-01 00:00:00,Monitor Ethereum Gas Prices and set notifications,2021-02-27 15:57:14.856711
chrome,ogajfoicbmjoggcpkmhddokjoipjbnkg,feel-the-fee,Feel the Fee,0.0,54,harry830622,2020-09-10 00:00:00,Check out real-time gas fees on Ethereum in whatever currency you like,2021-02-27 15:57:16.505745
chrome,ggebchafnnkaganepgccgnlmcadpkeok,dark-cuties-mods,Dark Cuties Mods,5.0,134,verychard,2020-05-23 00:00:00,Collection of addons and mods for the game Blockchain Cuties,2021-02-27 15:57:18.269636
chrome,blnieiiffboillknjnepogjhkgnoapac,equal-wallet,EQUAL Wallet,4.732142857142857,"1,000",equalnetwork,2021-01-05 00:00:00,EQUAL Wallet,2021-02-27 15:57:18.800180
chrome,fgkldlaelopgncepgpncndebgdddikii,julwallet,JulWallet,5.0,824,JustLiquidity,2021-02-18 00:00:00,A MultiWallet in your Browser,2021-02-27 15:57:22.531698
chrome,bjfnbiebjhlnpjjalelblpfhojmcdahb,metatransact-dappconnect,MetaTransact dAppConnect,0.0,18,MetaTransact,2020-06-03 00:00:00,MetaTransact dAppConnect allow users to pay Ethereum txn fee in ERC20 tokens,2021-02-27 15:57:29.155157
chrome,fkamanigbhmdpinnikifipiaaaodjhpc,youwallet,YOUWallet,5.0,16,YOUChain,2021-01-14 00:00:00,The wallet extension for YOUChain.,2021-02-27 15:57:29.665722
chrome,jpfolalfhhpgehgboellpeohdaggocli,hex-metatransact-dappconn,HEX MetaTransact dAppConnect,0.0,10,MetaTransact,2020-05-31 00:00:00,HEX MetaTransact dAppConnect allow users to pay Ethereum txn fee in ERC20 tokens,2021-02-27 15:57:31.769932
chrome,fnjhmkhhmkbjkkabndcnnogagogbneec,ronin-wallet,Ronin Wallet,4.986301369863014,"8,000",Sky Mavis,2021-02-04 00:00:00,A wallet for Sky Mavis's Ronin sidechain,2021-02-27 15:57:33.006306
chrome,jbdaocneiiinmjbjlgalhcelgbejmnid,nifty-wallet,Nifty Wallet,4.782608695652174,"5,000",POA Network,2021-01-17 00:00:00,Ethereum Browser Extension,2021-02-27 15:57:34.481266
chrome,ldjaieegladfnkopenlafecgcdkealec,metatransact-dappconnect,MetaTransact dAppConnect,0.0,5,MetaTransact,2020-05-31 00:00:00,MetaTransact dAppConnect allow users to pay Ethereum txn fee in ERC20 tokens,2021-02-27 15:57:37.373520
chrome,llpbjcejemjfaicajiephoejjnogfbed,bitcoin-tab,Bitcoin Tab,0.0,34,Bitcoin Tab,2020-11-29 00:00:00,Replace new tab page with a crypto dashboard,2021-02-27 15:57:54.205278
chrome,hmgpmiiifjnmojgmmcnccbcmoinehpkh,multicashback,MultiCashback,0.0,1,MultiCashback,2021-01-16 00:00:00,"Multiple different ways to earn Cashback. Get money back when you shop online, participate in surveys, or order new products.",2021-02-27 15:58:12.934573
chrome,hpglfhgfnhbgpjdenjgmdgoeiappafln,guarda,Guarda,4.0,"3,000",Guarda,2020-12-29 00:00:00,Browser extension for Ethereum and any blockchain,2021-02-27 15:58:50.587910
chrome,mengdaiflgahpehifoiopgcdbjapabpn,bitcoin-price-converter,Bitcoin price converter,4.5,20,coen.baars,2020-02-22 00:00:00,"With the online Bitcoin price converter, you can easily get today’s exchange rates of Bitcoin (BTC) in any fiat currency.",2021-02-27 15:58:51.267828
chrome,gkpgfnkkpnffhdidnjnainjfbfhoipbb,the-crypto-lab,The Crypto Lab,0.0,37,Louis Mzk,2020-03-20 00:00:00,"This extension was created to facilitate the purchase and resale of cryptocurrencies, on some of the best known platforms.",2021-02-27 16:00:06.597558
chrome,ieafcflodgfbcjeggikhlnckkfkhbmln,make-crypto-easier,Make Crypto Easier,0.0,0,Louis Mzk,2020-03-25 00:00:00,"This extension was created to facilitate the purchase and resale of cryptocurrencies, on some of the best known platforms.",2021-02-27 16:00:08.075499
chrome,hpglfhgfnhbgpjdenjgmdgoeiappafln,guarda,Guarda,4.0,"3,000",Guarda,2020-12-29 00:00:00,Browser extension for Ethereum and any blockchain,2021-02-27 16:00:14.352156
chrome,mengdaiflgahpehifoiopgcdbjapabpn,bitcoin-price-converter,Bitcoin price converter,4.5,20,coen.baars,2020-02-22 00:00:00,"With the online Bitcoin price converter, you can easily get today’s exchange rates of Bitcoin (BTC) in any fiat currency.",2021-02-27 16:00:19.316659
chrome,hpglfhgfnhbgpjdenjgmdgoeiappafln,guarda,Guarda,4.0,"3,000",Guarda,2020-12-29 00:00:00,Browser extension for Ethereum and any blockchain,2021-02-27 16:00:29.290901
chrome,pglehhnbhjhfddmbepbekkkegmcklige,namebase,Namebase,0.0,13,HNS,2020-09-26 00:00:00,Namebase is a top-level domain (TLD) name registrar that operates on the Handshake blockchain.,2021-02-27 16:00:36.353781
chrome,imijjbmbnebfnbmonjeileijahaipglj,moonlet-wallet,Moonlet Wallet,2.5833333333333335,"2,000",Moonlet,2020-11-04 00:00:00,Moonlet Wallet Extension,2021-02-27 16:00:37.438256
chrome,empdmmamahddmomggjgnanilliflpbkl,hnscan,HNSCAN,0.0,1,HNS,2020-09-21 00:00:00,Your trusted source for on chain Handshake information.,2021-02-27 16:00:40.616064
chrome,geomlnabmmmpobpkejfngpmgchgcemlj,chksender-blockchain-emai,ChkSender: Blockchain Email-Fraud Protection,5.0,190,Blockchain Security Corp.,2020-04-22 00:00:00,Spots email fraud instantly. Let's combat BEC attacks together with ChkSender.No need to alter your email usage habits!,2021-02-27 16:00:54.543186
chrome,fnnegphlobjdpkhecapkijjdkgcjhkib,harmony-one-wallet,Harmony One Wallet,3.7142857142857144,"2,000",Harmony,2021-02-13 00:00:00,Harmony One Browser Extension Wallet,2021-02-27 16:00:59.148720
chrome,bnpalipgomknhgbmgelaplknnmckljaf,currency-converter-widget,Currency Converter Widget - Exchange Rates,4.723404255319149,"2,000",Currency.Wiki,2020-12-06 00:00:00,Currency conversion extension for Google Chrome and Edge browser that is based on the Chromium open-source project.,2021-02-27 16:01:42.613279
chrome,mkjdcoeddifgnbbafjppfcabiggcfhmo,chargedesk-for-stripe-pay,"ChargeDesk for Stripe, PayPal & Braintree",5.0,"2,000",ChargeDesk,2021-02-25 00:00:00,"Manage payments inside tickets and emails. Works with Zendesk, Help Scout, Intercom, Freshdesk, Front, Desk.com, Gmail and more.",2021-02-27 16:01:49.657848
chrome,iplppiggblloelhoglpmkmbinggcaaoc,arweave,Arweave,4.923076923076923,"5,000",team,2020-03-08 00:00:00,Arweave web archiver and wallet.,2021-02-27 16:01:53.835828
chrome,hddhfbmnobjkpefjbkdihnjpejfkcfop,free-cash-and-coins-8-bal,Free Cash and Coins - 8 Ball Pool Hack,0.0,247,arulrajnellai,2020-12-01 00:00:00,"How to Get Unlimited Cash & Coins for Free, 8 Ball Pool Hack Mod APK. Allows you to add Unlimited Cash and Coins",2021-02-27 16:01:57.559750
chrome,encbagjjcfifhakoenggcgldeigmhmim,coin-master-free-spins-an,Coin Master Free Spins And Coins Daily,5.0,67,webhelper,2021-02-01 00:00:00,"Collect coin master free spins and coins, coin master free rewards daily",2021-02-27 16:01:59.641434
chrome,eoagnafocoghmnpapgfidjhgimemhihj,simpleswap-crypto-exchang,SimpleSwap Crypto Exchange,0.0,22,coingalaxynet,2020-06-12 00:00:00,Unofficial SimpleSwap Crypto Exchange,2021-02-27 16:02:03.107046
chrome,ljhbihnmlagpkkenjimeipkjgcdlceob,house-of-fun-free-coins,House of Fun Free Coins,0.0,22,123movies,2020-10-28 00:00:00,House of Fun Free Coins! ,2021-02-27 16:02:03.598695
chrome,bgddejjmhilkdllbakkgddjodommlimc,bitcoin-price-ticker,Bitcoin price ticker,4.2,"8,000",Extpose,2020-10-13 00:00:00,Shows bitcoin price provided by CoinDesk Bitcoin Price Index in a browser toolbar.,2021-02-27 16:02:15.384280
chrome,fbbckponafgkennhnmgfoikfmbkiplgp,coinstats-crypto-portfoli,CoinStats - Crypto Portfolio Tracker,4.631578947368421,"7,000",Coin Stats Inc,2020-10-09 00:00:00,Cryptocurrency live price and portfolio tracker.,2021-02-27 16:02:16.381399
chrome,ahboebefkdoiomfpehlgjehokjjlndmj,eth-ticker-ethereum-ticke,ETH Ticker | Ethereum Ticker | Token Ticker,4.2592592592592595,"3,000",Betonimig,2021-01-27 00:00:00,"Ethereum and Token exchange price ticker. Displays the current price on the badge icon, Chart and Alert notifications.",2021-02-27 16:02:16.925193
chrome,gidpkdpdnngpfohekcfkfjbkieeihekj,btc-ticker-bitcoin-ticker,BTC Ticker | Bitcoin Ticker,4.4,"3,000",Betonimig,2021-01-25 00:00:00,"Bitcoin and Token exchange price ticker. Displays the current price on the badge icon, Chart and Alert notifications.",2021-02-27 16:02:17.433892
chrome,ddmojnnanggcjkfpjlaeabeeadejcmde,ltc-ticker-litecoin-ticke,LTC Ticker | Litecoin Ticker,5.0,210,Betonimig,2021-01-26 00:00:00,"Litecoin and Token exchange price ticker. Displays the current price on the badge icon, Chart and Alert notifications.",2021-02-27 16:02:19.913079
chrome,iaadlolcdpmkjnlbogccfejeoghobemj,g999-ticker,G999 Ticker,0.0,22,Pieter vd Merwe,2021-02-19 00:00:00,This extension Shows G999 coin in USD price.,2021-02-27 16:02:22.230381
chrome,hpglfhgfnhbgpjdenjgmdgoeiappafln,guarda,Guarda,4.0,"3,000",Guarda,2020-12-29 00:00:00,Browser extension for Ethereum and any blockchain,2021-02-27 16:02:26.075503
chrome,jcacnejopjdphbnjgfaaobbfafkihpep,hive-keychain,Hive Keychain,4.333333333333333,"10,000",Matt Rosen (@yabapmatt),2021-01-05 00:00:00,Secure Hive Wallet Extension.,2021-02-27 16:02:27.211290
