platform,id,key,name,rating,user_numbers,creator,last_updated,introduction,record_time
chrome,dgafljegcabiiplpjmfcepmndcabcgpm,just-ethereum-ticker-pro,Just Ethereum Ticker [PRO],0.0,3,morocco,2020-11-05 00:00:00,Super lightweight minimalist extension that displays the current Ethereum price in USD.,2021-02-28 02:01:35.032747
chrome,gegmganblgchemddleocdoadmljledcj,neuma,Neuma,5.0,260,IOV SAS,2020-09-08 00:00:00,"Key manager and transaction signer for the IOV, Ethereum and Lisk blockchains",2021-02-28 02:01:36.078151
chrome,bjfnbiebjhlnpjjalelblpfhojmcdahb,metatransact-dappconnect,MetaTransact dAppConnect,0.0,18,MetaTransact,2020-06-03 00:00:00,MetaTransact dAppConnect allow users to pay Ethereum txn fee in ERC20 tokens,2021-02-28 02:01:37.420945
chrome,kkilomkmpmkbdnfelcpgckmpcaemjcdh,celoextensionwallet,CeloExtensionWallet,0.0,110,jiyun.kim,2021-02-23 00:00:00,A Celo Extension Wallet in your Browser,2021-02-28 02:01:40.368260
chrome,jpfolalfhhpgehgboellpeohdaggocli,hex-metatransact-dappconn,HEX MetaTransact dAppConnect,0.0,10,MetaTransact,2020-05-31 00:00:00,HEX MetaTransact dAppConnect allow users to pay Ethereum txn fee in ERC20 tokens,2021-02-28 02:01:40.868224
chrome,hdkoeaaegcmoljdaegapdpabifhjkgci,binance,Binance,1.0,62,Binance,2021-01-05 00:00:00,Binance Wallet,2021-02-28 02:01:44.615864
chrome,ogajfoicbmjoggcpkmhddokjoipjbnkg,feel-the-fee,Feel the Fee,0.0,54,harry830622,2020-09-10 00:00:00,Check out real-time gas fees on Ethereum in whatever currency you like,2021-02-28 02:01:46.119570
chrome,pdpahdgmbnpeepflkedmdcieohpcpchh,cryptocurrency-price-tick,Cryptocurrency Price Ticker,5.0,39,Ethan Chiasson,2020-02-01 00:00:00,"This extension displays the live price of Bitcoin, Litecoin, and Ethereum",2021-02-28 02:01:47.952998
chrome,llpbjcejemjfaicajiephoejjnogfbed,bitcoin-tab,Bitcoin Tab,0.0,34,Bitcoin Tab,2020-11-29 00:00:00,Replace new tab page with a crypto dashboard,2021-02-28 02:01:48.457908
chrome,ldjaieegladfnkopenlafecgcdkealec,metatransact-dappconnect,MetaTransact dAppConnect,0.0,5,MetaTransact,2020-05-31 00:00:00,MetaTransact dAppConnect allow users to pay Ethereum txn fee in ERC20 tokens,2021-02-28 02:01:49.052773
chrome,gfchpofllbnjfhgmjbgmhljdpolcjing,mraddon-blockchain-viewer,MrAddon BlockChain Viewer for Chrome,0.0,24,MrAddon ®,2020-11-24 00:00:00,"MrAddon BlockChain Viewer for Chrome. Control the prices of Bitcoin, Ethereum, Litecoin, tokens etc all time",2021-02-28 02:01:50.393008
chrome,njnbpngnahedeekpedjkbaeihhihlbko,ethassistant,ETHAssistant,0.0,20,jeffrey.stone2020,2020-05-11 00:00:00,Helper for сomfortable working with Ethereum addresses in any websites and unique antiphishing utils for crypto enthusiasts.,2021-02-28 02:01:52.159127
chrome,ffkicalblogbdapjfckabempifkaieia,cryptocurrency-rates,Cryptocurrency Rates,4.0,16,Psych,2020-02-01 00:00:00,Constantly checks the rates of any cryptocurrency of your choice,2021-02-28 02:01:52.658583
chrome,cjelfplplebdjjenllpjcblmjkfcffne,jaxx-liberty,Jaxx Liberty,4.027027027027027,"30,000",Decentral Inc.,2021-02-01 00:00:00,Unifying the Blockchain Wallet experience across devices.,2021-02-28 02:01:57.723759
chrome,njbclohenpagagafbmdipcdoogfpnfhp,ethereum-gas-prices,Ethereum Gas Prices,5.0,888,Philippe Masset,2021-02-26 00:00:00,"Ethereum gas price info, always up to date, from multiple sources",2021-02-28 02:02:01.333130
chrome,ahboebefkdoiomfpehlgjehokjjlndmj,eth-ticker-ethereum-ticke,ETH Ticker | Ethereum Ticker | Token Ticker,4.2592592592592595,"3,000",Betonimig,2021-01-27 00:00:00,"Ethereum and Token exchange price ticker. Displays the current price on the badge icon, Chart and Alert notifications.",2021-02-28 02:02:02.627991
chrome,jbdaocneiiinmjbjlgalhcelgbejmnid,nifty-wallet,Nifty Wallet,4.782608695652174,"5,000",POA Network,2021-01-17 00:00:00,Ethereum Browser Extension,2021-02-28 02:02:03.168759
chrome,nkbihfbeogaeaoehlefnkodbefgpgknn,metamask,MetaMask,3.855213398163155,"2,000",metamask,2021-02-10 00:00:00,An Ethereum Wallet in your Browser,2021-02-28 02:02:03.667694
chrome,mbfcnfgpimdeehokhmhdhmpmkphdeamd,ethereum-price-ticker-eth,Ethereum Price Ticker | ETH Price Ticker,5.0,635,"Root Consulting, Inc",2021-01-05 00:00:00,Displays the current Ethereum (ETH) price.,2021-02-28 02:02:04.688510
chrome,innfmlnnhfcebjcnfopadflecemoddnp,ethereum-gas-price-extens,Ethereum Gas Price Extension,4.818181818181818,"9,000",nieldlr,2020-11-04 00:00:00,Displays the current gas price using your preferred gas price provider.,2021-02-28 02:02:06.007185
chrome,pdknmigbbbhmllnmgdfalmedcmcefdfn,etheraddresslookup,EtherAddressLookup,4.561224489795919,"60,000",Harry,2020-09-04 00:00:00,Adds links to strings that look like Ethereum addresses to your favorite blockchain explorer + antiphishing measures.,2021-02-28 02:02:07.692146
chrome,hpglfhgfnhbgpjdenjgmdgoeiappafln,guarda,Guarda,4.0,"3,000",Guarda,2020-12-29 00:00:00,Browser extension for Ethereum and any blockchain,2021-02-28 02:02:08.962965
chrome,mhhgjpidhclpobhkdnlopdfhfamalnia,stormx-shop-earn-crypto,StormX: Shop & Earn Crypto,5.0,"6,000",StormX Singapore PTE. LTD.,2021-02-15 00:00:00,StormX,2021-02-28 02:02:11.346095
chrome,fhbohimaelbohpjbbldcngcnapndodjp,binance-chain-wallet,Binance Chain Wallet,2.628205128205128,"200,000",Binance Chain,2021-02-25 00:00:00,"A Crypto Wallet for Binance Chain, Binance Smart Chain and Ethereum",2021-02-28 02:02:12.338890
chrome,ainmgbleakflfgjjoolgmgfepddnpeln,ethereum-monitor,Ethereum monitor,0.0,16,Awork,2020-07-15 00:00:00,Everything about Ethereum in one extension,2021-02-28 02:02:15.337732
chrome,eachlnokbkckmbhglohpcmhllebcdbme,ethereum-price-ticker-ale,Ethereum Price Ticker & Alert,0.0,27,happy elephant web development,2020-09-08 00:00:00,Show the Ethereum ticker price and set an alert so that the browser icon will flash when the alert price is passed.,2021-02-28 02:02:15.837620
chrome,nganaoejibmmoecajmpimkgmbkhfmhoj,fireth,Fireth,5.0,589,ETHSagan,2020-09-23 00:00:00,The most efficient Ethereum GAS price tracker,2021-02-28 02:02:19.071089
chrome,dconegbmnkoeccohdkifggkgdhoaedgc,ethereum-ethusd-price-tic,Ethereum (ETH/USD) Price Ticker,5.0,139,Taha,2020-03-20 00:00:00,This extension shows latest price of ETH in USD.,2021-02-28 02:02:21.001652
chrome,dlnalaneihafdkdcekejdekiclgdghka,breadcrumbs-blockchain-in,Breadcrumbs Blockchain Investigate,5.0,20,Breadcrumbs,2020-08-22 00:00:00,Tired of tracking of Ethereum addresses with an excel spreadsheet?  Wasting time loading webpages to follow an Ethereum whale?…,2021-02-28 02:02:21.521869
chrome,caddnmdigajdehmjbnlkpmnckkcneckf,ethereum-price-in-usd-by,Ethereum price in USD by BitcoinFan,5.0,33,BitcoinFan,2020-12-26 00:00:00,"This extension displays the current Ethereum price in USD on the badge. If you click it, a chart of the last 24h will be displayed.",2021-02-28 02:02:22.298573
chrome,nkddgncdjgjfcddamfgcmfnlhccnimig,saturn-wallet,Saturn Wallet,4.647058823529412,"2,000",Saturn Network,2020-01-29 00:00:00,Ethereum Browser Extension,2021-02-28 02:02:22.797776
chrome,blnieiiffboillknjnepogjhkgnoapac,equal-wallet,EQUAL Wallet,4.732142857142857,"1,000",equalnetwork,2021-01-05 00:00:00,EQUAL Wallet,2021-02-28 02:02:24.118247
chrome,afgfdkloegmghldbalmenklokhlifphe,defi-saver-gas-prices-ext,DeFi Saver Gas Prices Extension,4.777777777777778,"1,000",DeFi Saver,2021-01-18 00:00:00,Ethereum gas prices extension with dark and light modes and 7-day historical data.,2021-02-28 02:02:25.459625
chrome,lacghifpplnkgbelccecflapgnknmnci,ethereum-gas-watcher,Ethereum Gas Watcher,0.0,12,matnad,2021-02-01 00:00:00,Monitor Ethereum Gas Prices and set notifications,2021-02-28 02:02:27.778080
chrome,gmmnjkphjfnanlojihefoeidjmbakfde,ethereum-price-in-eur-by,Ethereum price in EUR by BitcoinFan,5.0,19,BitcoinFan,2020-12-26 00:00:00,"This extension displays the current Ethereum price in EUR on the badge. If you click it, a chart of the last 24h will be displayed.",2021-02-28 02:02:29.548219
chrome,fbbckponafgkennhnmgfoikfmbkiplgp,coinstats-crypto-portfoli,CoinStats - Crypto Portfolio Tracker,4.5,"7,000",Coin Stats Inc,2020-10-09 00:00:00,Cryptocurrency live price and portfolio tracker.,2021-02-28 02:02:33.997554
chrome,hipgfnjghjmfdebgmenoipheomjheknn,decamask,DECAMask,5.0,96,DECA,2020-07-04 00:00:00,An Ethereum Wallet in your Browser,2021-02-28 02:02:35.558897
chrome,japgcbmdokcibjdencjalgfjeglgbcgc,tx-ray-beta-protect-your,TX-ray (Beta): Protect Your Wallets,5.0,16,TX-ray,2020-03-19 00:00:00,"🔒The easiest, fastest way to protect your Ethereum wallet.",2021-02-28 02:02:36.635634
chrome,ejeemacpidnaejkhpbmfkadhgjhnolaa,ezdefi,ezDeFi,4.923076923076923,"2,000",ezdefi.com,2021-02-20 00:00:00,A Blockchain Wallet in your Browser,2021-02-28 02:02:37.128362
chrome,fhhkkooikehnkaodebbfnkinedlllcfk,blockchair,Blockchair,5.0,"2,000",Blockchair,2021-01-18 00:00:00,"Block explorer and anonymous crypto portfolio tracker for Bitcoin, Ethereum, and others in your browser",2021-02-28 02:02:37.625319
chrome,obhemlghbbloobahdlkjmniichcandhd,простой-конвертер-валют,Простой конвертер валют,4.2105263157894735,"1,000",MaxPax,2020-06-10 00:00:00,"Калькулятор курсов для валют: доллары, рубли, гривны, белорусские рубли, евро, польские злотые, BitCoin, Ethereum, Zcash, Litecoin",2021-02-28 02:02:39.492228
chrome,fgkldlaelopgncepgpncndebgdddikii,julwallet,JulWallet,5.0,878,JustLiquidity,2021-02-18 00:00:00,A MultiWallet in your Browser,2021-02-28 02:02:40.843227
chrome,jlbkpppjbkmkjjemjcofmccodofkknmc,cryptocurrency-prices-cha,Cryptocurrency Prices & Charts - BitDuck,5.0,611,CrisValls,2021-02-25 00:00:00,"Displays real-time prices and charts of different cryptocurrencies at 1 click, including from the browser bar.",2021-02-28 02:02:43.686458
chrome,cmbagcoinhmacpcgmbiniijboejgiahi,justliquidity-wallet,JustLiquidity Wallet,5.0,381,JustLiquidity,2020-10-13 00:00:00,Ethereum Browser Extension,2021-02-28 02:02:45.498284
chrome,mnlfoooikhmcaomegmfopecjngldnmmn,ethermine-watcher,Ethermine Watcher,0.0,404,DW Crypto,2020-05-19 00:00:00,"Watch your Ethermine hashrate, balance, ETA until payout and more.",2021-02-28 02:02:46.681291
chrome,ccnipbjnnkophfgnkmhdongajmkhijbl,gasnow-eth-gasprice-forec,GasNow - ETH GasPrice forecast system,4.857142857142857,315,GasNow.org,2021-02-23 00:00:00,The coolest tool to estimate the gas price of Ethereum,2021-02-28 02:02:47.706249
chrome,dgafljegcabiiplpjmfcepmndcabcgpm,just-ethereum-ticker-pro,Just Ethereum Ticker [PRO],0.0,3,morocco,2020-11-05 00:00:00,Super lightweight minimalist extension that displays the current Ethereum price in USD.,2021-02-28 02:02:49.649782
chrome,gegmganblgchemddleocdoadmljledcj,neuma,Neuma,5.0,260,IOV SAS,2020-09-08 00:00:00,"Key manager and transaction signer for the IOV, Ethereum and Lisk blockchains",2021-02-28 02:02:50.835055
chrome,bjfnbiebjhlnpjjalelblpfhojmcdahb,metatransact-dappconnect,MetaTransact dAppConnect,0.0,18,MetaTransact,2020-06-03 00:00:00,MetaTransact dAppConnect allow users to pay Ethereum txn fee in ERC20 tokens,2021-02-28 02:02:51.392844
chrome,kkilomkmpmkbdnfelcpgckmpcaemjcdh,celoextensionwallet,CeloExtensionWallet,0.0,110,jiyun.kim,2021-02-23 00:00:00,A Celo Extension Wallet in your Browser,2021-02-28 02:02:54.216134
chrome,jpfolalfhhpgehgboellpeohdaggocli,hex-metatransact-dappconn,HEX MetaTransact dAppConnect,0.0,10,MetaTransact,2020-05-31 00:00:00,HEX MetaTransact dAppConnect allow users to pay Ethereum txn fee in ERC20 tokens,2021-02-28 02:02:54.725458
chrome,hdkoeaaegcmoljdaegapdpabifhjkgci,binance,Binance,1.0,62,Binance,2021-01-05 00:00:00,Binance Wallet,2021-02-28 02:02:57.013630
chrome,ogajfoicbmjoggcpkmhddokjoipjbnkg,feel-the-fee,Feel the Fee,0.0,54,harry830622,2020-09-10 00:00:00,Check out real-time gas fees on Ethereum in whatever currency you like,2021-02-28 02:03:00.127074
chrome,pdpahdgmbnpeepflkedmdcieohpcpchh,cryptocurrency-price-tick,Cryptocurrency Price Ticker,5.0,39,Ethan Chiasson,2020-02-01 00:00:00,"This extension displays the live price of Bitcoin, Litecoin, and Ethereum",2021-02-28 02:03:01.088624
chrome,llpbjcejemjfaicajiephoejjnogfbed,bitcoin-tab,Bitcoin Tab,0.0,34,Bitcoin Tab,2020-11-29 00:00:00,Replace new tab page with a crypto dashboard,2021-02-28 02:03:01.616462
chrome,ldjaieegladfnkopenlafecgcdkealec,metatransact-dappconnect,MetaTransact dAppConnect,0.0,5,MetaTransact,2020-05-31 00:00:00,MetaTransact dAppConnect allow users to pay Ethereum txn fee in ERC20 tokens,2021-02-28 02:03:02.123272
chrome,gfchpofllbnjfhgmjbgmhljdpolcjing,mraddon-blockchain-viewer,MrAddon BlockChain Viewer for Chrome,0.0,24,MrAddon ®,2020-11-24 00:00:00,"MrAddon BlockChain Viewer for Chrome. Control the prices of Bitcoin, Ethereum, Litecoin, tokens etc all time",2021-02-28 02:03:02.618280
chrome,njnbpngnahedeekpedjkbaeihhihlbko,ethassistant,ETHAssistant,0.0,20,jeffrey.stone2020,2020-05-11 00:00:00,Helper for сomfortable working with Ethereum addresses in any websites and unique antiphishing utils for crypto enthusiasts.,2021-02-28 02:03:03.618511
chrome,ffkicalblogbdapjfckabempifkaieia,cryptocurrency-rates,Cryptocurrency Rates,4.0,16,Psych,2020-02-01 00:00:00,Constantly checks the rates of any cryptocurrency of your choice,2021-02-28 02:03:04.133063
chrome,cjelfplplebdjjenllpjcblmjkfcffne,jaxx-liberty,Jaxx Liberty,4.027027027027027,"30,000",Decentral Inc.,2021-02-01 00:00:00,Unifying the Blockchain Wallet experience across devices.,2021-02-28 02:03:08.248291
chrome,hpglfhgfnhbgpjdenjgmdgoeiappafln,guarda,Guarda,4.0,"3,000",Guarda,2020-12-29 00:00:00,Browser extension for Ethereum and any blockchain,2021-02-28 02:03:11.044706
chrome,ifpkfkehopifpgccncppdicimhcimccj,motocross-xtreme-stunts,Motocross Xtreme Stunts,0.0,"20,000",wellner.shenna1830,2020-05-04 00:00:00,In this motocross game you need to pass all nine levels and to earn points. Collect coins and do some stunts for extra points. Bal,2021-02-28 02:03:46.075527
chrome,mebalpjlaipopoeiekhmfkmoifpkfaki,fetchai-web-wallet,Fetch.ai Web Wallet,0.0,55,Fetch.AI,2020-04-24 00:00:00,The Fetch.ai Web Wallet is a Chrome Extension for making interactions with the Fetch.ai Ledger super easy,2021-02-28 02:03:58.572569
chrome,hkckdnfadmnkgmkojfhdihollnjhlaam,smartify-price-comparison,Smartify: Price comparison & Coupon codes,5.0,243,Smartify: Price comparison & Coupon codes,2021-02-26 00:00:00,Saves you money and time when you shop online,2021-02-28 02:04:18.949592
chrome,kjncpaiejgkgpgiiibmnjnkahokdgfap,memorai-–-ai-memory-assis,Memorai – AI memory assistant for Anki,4.125,628,humanloop,2021-01-24 00:00:00,AI memory assistant for Anki – remember everything you read by automatically generating question cards from text.,2021-02-28 02:04:32.228662
chrome,oaleidlaomjgnhfhpihkohgihgdcibmj,lowtels-chrome-extension,LowTels Chrome Extension V2.0,4.5,11,Wholesale Hotels Group,2020-09-03 00:00:00,www.Low-Tels.com provides one of the lowest travel industry rates on hotels and also provides the MOST REWARDING HOTEL CASH-BACK…,2021-02-28 02:05:39.000039
chrome,cdkfohddmakcgfajhnacobhdgddahlap,cryptocurrency-news-tab,Cryptocurrency News Tab,5.0,82,newstab.com,2021-02-08 00:00:00,Get top Cryptocurrency news on your Chrome new tab page. Add any topic or news source.,2021-02-28 02:05:45.256784
chrome,ifpkfkehopifpgccncppdicimhcimccj,motocross-xtreme-stunts,Motocross Xtreme Stunts,0.0,"20,000",wellner.shenna1830,2020-05-04 00:00:00,In this motocross game you need to pass all nine levels and to earn points. Collect coins and do some stunts for extra points. Bal,2021-02-28 02:06:03.840687
chrome,innfmlnnhfcebjcnfopadflecemoddnp,ethereum-gas-price-extens,Ethereum Gas Price Extension,4.818181818181818,"9,000",nieldlr,2020-11-04 00:00:00,Displays the current gas price using your preferred gas price provider.,2021-02-28 02:06:04.962546
chrome,afgfdkloegmghldbalmenklokhlifphe,defi-saver-gas-prices-ext,DeFi Saver Gas Prices Extension,4.777777777777778,"1,000",DeFi Saver,2021-01-18 00:00:00,Ethereum gas prices extension with dark and light modes and 7-day historical data.,2021-02-28 02:06:06.302858
chrome,lfjcgcmkmjjlieihflfhjopckgpelofo,google-apps-script-github,Google Apps Script GitHub Assistant,4.794871794871795,"10,000",leonhartX,2021-01-21 00:00:00,Manage your gas code with github/github enterprise/bitbucket/gitlab,2021-02-28 02:06:07.575401
chrome,njbclohenpagagafbmdipcdoogfpnfhp,ethereum-gas-prices,Ethereum Gas Prices,5.0,888,Philippe Masset,2021-02-26 00:00:00,"Ethereum gas price info, always up to date, from multiple sources",2021-02-28 02:06:08.041760
chrome,nganaoejibmmoecajmpimkgmbkhfmhoj,fireth,Fireth,5.0,589,ETHSagan,2020-09-23 00:00:00,The most efficient Ethereum GAS price tracker,2021-02-28 02:06:11.223008
chrome,ccnipbjnnkophfgnkmhdongajmkhijbl,gasnow-eth-gasprice-forec,GasNow - ETH GasPrice forecast system,4.857142857142857,315,GasNow.org,2021-02-23 00:00:00,The coolest tool to estimate the gas price of Ethereum,2021-02-28 02:06:15.804647
chrome,lacghifpplnkgbelccecflapgnknmnci,ethereum-gas-watcher,Ethereum Gas Watcher,0.0,12,matnad,2021-02-01 00:00:00,Monitor Ethereum Gas Prices and set notifications,2021-02-28 02:06:17.088163
chrome,ogajfoicbmjoggcpkmhddokjoipjbnkg,feel-the-fee,Feel the Fee,0.0,54,harry830622,2020-09-10 00:00:00,Check out real-time gas fees on Ethereum in whatever currency you like,2021-02-28 02:06:19.523710
chrome,ggebchafnnkaganepgccgnlmcadpkeok,dark-cuties-mods,Dark Cuties Mods,5.0,135,verychard,2020-05-23 00:00:00,Collection of addons and mods for the game Blockchain Cuties,2021-02-28 02:06:21.219170
chrome,blnieiiffboillknjnepogjhkgnoapac,equal-wallet,EQUAL Wallet,4.732142857142857,"1,000",equalnetwork,2021-01-05 00:00:00,EQUAL Wallet,2021-02-28 02:06:21.902715
chrome,fgkldlaelopgncepgpncndebgdddikii,julwallet,JulWallet,5.0,878,JustLiquidity,2021-02-18 00:00:00,A MultiWallet in your Browser,2021-02-28 02:06:25.848972
chrome,bjfnbiebjhlnpjjalelblpfhojmcdahb,metatransact-dappconnect,MetaTransact dAppConnect,0.0,18,MetaTransact,2020-06-03 00:00:00,MetaTransact dAppConnect allow users to pay Ethereum txn fee in ERC20 tokens,2021-02-28 02:06:32.743915
chrome,fkamanigbhmdpinnikifipiaaaodjhpc,youwallet,YOUWallet,5.0,17,YOUChain,2021-01-14 00:00:00,The wallet extension for YOUChain.,2021-02-28 02:06:33.248421
chrome,jpfolalfhhpgehgboellpeohdaggocli,hex-metatransact-dappconn,HEX MetaTransact dAppConnect,0.0,10,MetaTransact,2020-05-31 00:00:00,HEX MetaTransact dAppConnect allow users to pay Ethereum txn fee in ERC20 tokens,2021-02-28 02:06:36.839786
chrome,fnjhmkhhmkbjkkabndcnnogagogbneec,ronin-wallet,Ronin Wallet,4.986301369863014,"8,000",Sky Mavis,2021-02-04 00:00:00,A wallet for Sky Mavis's Ronin sidechain,2021-02-28 02:06:38.378844
chrome,jbdaocneiiinmjbjlgalhcelgbejmnid,nifty-wallet,Nifty Wallet,4.782608695652174,"5,000",POA Network,2021-01-17 00:00:00,Ethereum Browser Extension,2021-02-28 02:06:40.143924
chrome,ldjaieegladfnkopenlafecgcdkealec,metatransact-dappconnect,MetaTransact dAppConnect,0.0,5,MetaTransact,2020-05-31 00:00:00,MetaTransact dAppConnect allow users to pay Ethereum txn fee in ERC20 tokens,2021-02-28 02:06:43.057672
chrome,llpbjcejemjfaicajiephoejjnogfbed,bitcoin-tab,Bitcoin Tab,0.0,34,Bitcoin Tab,2020-11-29 00:00:00,Replace new tab page with a crypto dashboard,2021-02-28 02:06:57.741259
chrome,hmgpmiiifjnmojgmmcnccbcmoinehpkh,multicashback,MultiCashback,0.0,1,MultiCashback,2021-01-16 00:00:00,"Multiple different ways to earn Cashback. Get money back when you shop online, participate in surveys, or order new products.",2021-02-28 02:07:18.190126
chrome,gkpgfnkkpnffhdidnjnainjfbfhoipbb,the-crypto-lab,The Crypto Lab,0.0,39,Louis Mzk,2020-03-20 00:00:00,"This extension was created to facilitate the purchase and resale of cryptocurrencies, on some of the best known platforms.",2021-02-28 02:09:27.193780
chrome,ieafcflodgfbcjeggikhlnckkfkhbmln,make-crypto-easier,Make Crypto Easier,0.0,0,Louis Mzk,2020-03-25 00:00:00,"This extension was created to facilitate the purchase and resale of cryptocurrencies, on some of the best known platforms.",2021-02-28 02:09:28.684102
chrome,hpglfhgfnhbgpjdenjgmdgoeiappafln,guarda,Guarda,4.0,"3,000",Guarda,2020-12-29 00:00:00,Browser extension for Ethereum and any blockchain,2021-02-28 02:09:30.056334
chrome,mengdaiflgahpehifoiopgcdbjapabpn,bitcoin-price-converter,Bitcoin price converter,4.5,20,coen.baars,2020-02-22 00:00:00,"With the online Bitcoin price converter, you can easily get today’s exchange rates of Bitcoin (BTC) in any fiat currency.",2021-02-28 02:09:30.540650
chrome,hpglfhgfnhbgpjdenjgmdgoeiappafln,guarda,Guarda,4.0,"3,000",Guarda,2020-12-29 00:00:00,Browser extension for Ethereum and any blockchain,2021-02-28 02:09:38.583176
chrome,mengdaiflgahpehifoiopgcdbjapabpn,bitcoin-price-converter,Bitcoin price converter,4.5,20,coen.baars,2020-02-22 00:00:00,"With the online Bitcoin price converter, you can easily get today’s exchange rates of Bitcoin (BTC) in any fiat currency.",2021-02-28 02:09:45.107535
chrome,pglehhnbhjhfddmbepbekkkegmcklige,namebase,Namebase,0.0,13,HNS,2020-09-26 00:00:00,Namebase is a top-level domain (TLD) name registrar that operates on the Handshake blockchain.,2021-02-28 02:11:46.547531
chrome,imijjbmbnebfnbmonjeileijahaipglj,moonlet-wallet,Moonlet Wallet,2.5833333333333335,"2,000",Moonlet,2020-11-04 00:00:00,Moonlet Wallet Extension,2021-02-28 02:11:49.213304
chrome,empdmmamahddmomggjgnanilliflpbkl,hnscan,HNSCAN,0.0,1,HNS,2020-09-21 00:00:00,Your trusted source for on chain Handshake information.,2021-02-28 02:11:52.617052
chrome,geomlnabmmmpobpkejfngpmgchgcemlj,chksender-blockchain-emai,ChkSender: Blockchain Email-Fraud Protection,5.0,193,Blockchain Security Corp.,2020-04-22 00:00:00,Spots email fraud instantly. Let's combat BEC attacks together with ChkSender.No need to alter your email usage habits!,2021-02-28 02:12:06.810312
chrome,bnpalipgomknhgbmgelaplknnmckljaf,currency-converter-widget,Currency Converter Widget - Exchange Rates,4.726315789473684,"2,000",Currency.Wiki,2020-12-06 00:00:00,Currency conversion extension for Google Chrome and Edge browser that is based on the Chromium open-source project.,2021-02-28 02:12:12.927815
chrome,hpglfhgfnhbgpjdenjgmdgoeiappafln,guarda,Guarda,4.0,"3,000",Guarda,2020-12-29 00:00:00,Browser extension for Ethereum and any blockchain,2021-02-28 02:12:15.003614
chrome,fnnegphlobjdpkhecapkijjdkgcjhkib,harmony-one-wallet,Harmony One Wallet,3.7142857142857144,"2,000",Harmony,2021-02-13 00:00:00,Harmony One Browser Extension Wallet,2021-02-28 02:12:16.735790
chrome,mkjdcoeddifgnbbafjppfcabiggcfhmo,chargedesk-for-stripe-pay,"ChargeDesk for Stripe, PayPal & Braintree",5.0,"2,000",ChargeDesk,2021-02-25 00:00:00,"Manage payments inside tickets and emails. Works with Zendesk, Help Scout, Intercom, Freshdesk, Front, Desk.com, Gmail and more.",2021-02-28 02:13:09.524623
chrome,iplppiggblloelhoglpmkmbinggcaaoc,arweave,Arweave,4.923076923076923,"5,000",team,2020-03-08 00:00:00,Arweave web archiver and wallet.,2021-02-28 02:13:14.386989
chrome,hddhfbmnobjkpefjbkdihnjpejfkcfop,free-cash-and-coins-8-bal,Free Cash and Coins - 8 Ball Pool Hack,0.0,266,arulrajnellai,2020-12-01 00:00:00,"How to Get Unlimited Cash & Coins for Free, 8 Ball Pool Hack Mod APK. Allows you to add Unlimited Cash and Coins",2021-02-28 02:13:16.996186
chrome,encbagjjcfifhakoenggcgldeigmhmim,coin-master-free-spins-an,Coin Master Free Spins And Coins Daily,5.0,69,webhelper,2021-02-01 00:00:00,"Collect coin master free spins and coins, coin master free rewards daily",2021-02-28 02:13:20.424795
chrome,eoagnafocoghmnpapgfidjhgimemhihj,simpleswap-crypto-exchang,SimpleSwap Crypto Exchange,0.0,21,coingalaxynet,2020-06-12 00:00:00,Unofficial SimpleSwap Crypto Exchange,2021-02-28 02:13:23.846029
chrome,ljhbihnmlagpkkenjimeipkjgcdlceob,house-of-fun-free-coins,House of Fun Free Coins,0.0,25,123movies,2020-10-28 00:00:00,House of Fun Free Coins! ,2021-02-28 02:13:25.191002
chrome,jpfolalfhhpgehgboellpeohdaggocli,hex-metatransact-dappconn,HEX MetaTransact dAppConnect,0.0,10,MetaTransact,2020-05-31 00:00:00,HEX MetaTransact dAppConnect allow users to pay Ethereum txn fee in ERC20 tokens,2021-02-28 02:14:04.747137
chrome,pdknmigbbbhmllnmgdfalmedcmcefdfn,etheraddresslookup,EtherAddressLookup,4.561224489795919,"60,000",Harry,2020-09-04 00:00:00,Adds links to strings that look like Ethereum addresses to your favorite blockchain explorer + antiphishing measures.,2021-02-28 02:14:34.646134
chrome,fhhkkooikehnkaodebbfnkinedlllcfk,blockchair,Blockchair,5.0,"2,000",Blockchair,2021-01-18 00:00:00,"Block explorer and anonymous crypto portfolio tracker for Bitcoin, Ethereum, and others in your browser",2021-02-28 02:14:52.848970
chrome,mnlfoooikhmcaomegmfopecjngldnmmn,ethermine-watcher,Ethermine Watcher,0.0,404,DW Crypto,2020-05-19 00:00:00,"Watch your Ethermine hashrate, balance, ETA until payout and more.",2021-02-28 02:14:55.544805
chrome,fkamanigbhmdpinnikifipiaaaodjhpc,youwallet,YOUWallet,5.0,17,YOUChain,2021-01-14 00:00:00,The wallet extension for YOUChain.,2021-02-28 02:14:57.080533
chrome,ggebchafnnkaganepgccgnlmcadpkeok,dark-cuties-mods,Dark Cuties Mods,5.0,135,verychard,2020-05-23 00:00:00,Collection of addons and mods for the game Blockchain Cuties,2021-02-28 02:14:58.839214
chrome,ajbjjjcoielbnkfidmbbhdledkmiobda,alfarotator,AlfaRotator,4.572093023255814,"2,000",alfarotator,2020-05-26 00:00:00,"Multicurrency faucet rotator which increase your profit, simplify and accelerate satoshi collection.",2021-02-28 02:14:59.881664
chrome,bgddejjmhilkdllbakkgddjodommlimc,bitcoin-price-ticker,Bitcoin price ticker,4.2,"8,000",Extpose,2020-10-13 00:00:00,Shows bitcoin price provided by CoinDesk Bitcoin Price Index in a browser toolbar.,2021-02-28 02:15:14.593133
