platform,id,key,name,rating,user_numbers,creator,last_updated,introduction,record_time
chrome,flfdeojdcmafkipiacfmdgnijodanedb,pr-status,PR Status,5.0,84,rehanahmad,2020-10-23 00:00:00,Show Github PR Review Approval status in the cards on a Jira board,2021-02-27 16:42:43.254534
chrome,dbfipcjecamggjfabeaclacjoohfjhhn,кэшбэк-сервис-мегабонус,Cash Back Service Megabonus,4.64132730015083,"200,000",Webimatic LTD,2021-02-21 00:00:00,Service helping to make smart online purchases,2021-02-27 16:43:16.241785
chrome,mhhgjpidhclpobhkdnlopdfhfamalnia,stormx-shop-earn-crypto,StormX: Shop & Earn Crypto,5.0,"6,000",StormX Singapore PTE. LTD.,2021-02-15 00:00:00,StormX,2021-02-27 16:43:38.559481
chrome,cdopijddofmobcpbhmikjglcfmjijlka,stratis-stratbtc-price-ti,Stratis (STRAT/BTC) Price Ticker,3.5,37,Taha,2020-03-17 00:00:00,This extension shows latest price of STRAT/BTC for bittrex.,2021-02-27 16:43:39.508846
chrome,cfnpidifppmenkapgihekkeednfoenal,trafficlight,TrafficLight,4.495278069254984,"700,000",Bitdefender Labs,2020-10-13 00:00:00,Bitdefender TrafficLight adds a strong and non-intrusive layer of security to your browsing experience.,2021-02-27 16:44:09.913347
chrome,cbomnldpfbpmaonfclcbmhhcphgaljhe,bitsell-x,Bitsell X,4.333333333333333,310,ABP Interactive,2020-06-07 00:00:00,"Trade 100+ cryptocurrencies FAST! Non-Custodial, Lax verification, No account, BEST market rates. Even EUR/USD credit card accepted!",2021-02-27 16:44:39.728387
chrome,cknoenfpneihlklphnieimfaolpaammb,haspit,Haspit,0.0,22,"Haspit, Inc.",2020-11-25 00:00:00,Haspit | Secure Your Email with Blockchain,2021-02-27 16:45:03.697606
chrome,bcacfldlkkdogcmkkibnjlakofdplcbk,freighter,Freighter,4.714285714285714,810,stellar.org,2021-02-25 00:00:00,Freighter is a non-custodial wallet extension that enables you to sign Stellar transactions via your browser.,2021-02-27 16:45:13.707279
chrome,kpcngaggbajehefdinhniockfhdhacnb,coinbag-track-all-your-co,Coinbag - Track all your coins in one place,5.0,100,CoinBag,2020-05-29 00:00:00,"Track price of bitcoin, Ethererum, Ripple, IOTA, EOS, Stellar and more than 1000 coins",2021-02-27 16:45:19.301142
chrome,hpglfhgfnhbgpjdenjgmdgoeiappafln,guarda,Guarda,4.0,"3,000",Guarda,2020-12-29 00:00:00,Browser extension for Ethereum and any blockchain,2021-02-27 16:45:22.606674
chrome,apackbelmolgjpdfegmnkpajpdnchkgp,2020wallet,2020Wallet,5.0,33,unfoldlabs,2020-09-07 00:00:00,Automatic login to your websites with single swipe.,2021-02-27 16:46:29.476543
chrome,mipeohjjimeknlkekbemdjbjniogbgel,hubstaff-time-tracker,Hubstaff Time Tracker,4.363636363636363,"10,000","Netsoft Holdings, LLC",2020-10-06 00:00:00,"Chrome time tracker with screenshots, online timesheets, task management, url monitoring & employee payroll",2021-02-27 16:49:23.324131
chrome,ookjlbkiijinhpmnjffcofjonbfbgaoc,temple-tezos-wallet-ex-th,Temple - Tezos Wallet (ex. Thanos),5.0,"1,000",Madfish Solutions,2021-02-24 00:00:00,🔐💰Cryptocurrency wallet for Tezos blockchain as Web Extension for your Browser.,2021-02-27 16:49:56.954269
chrome,hpglfhgfnhbgpjdenjgmdgoeiappafln,guarda,Guarda,4.0,"3,000",Guarda,2020-12-29 00:00:00,Browser extension for Ethereum and any blockchain,2021-02-27 16:49:59.777266
chrome,gnamoippebdncomaimedfleloliapala,akila-wallet,Akila Wallet,5.0,5,info,2021-02-15 00:00:00,Cryptocurrency wallet for Tezos blockchain as Web Extension for your Browser.,2021-02-27 16:50:00.311639
chrome,jlbkpppjbkmkjjemjcofmccodofkknmc,cryptocurrency-prices-cha,Cryptocurrency Prices & Charts - BitDuck,5.0,604,CrisValls,2021-02-25 00:00:00,"Displays real-time prices and charts of different cryptocurrencies at 1 click, including from the browser bar.",2021-02-27 16:50:00.880276
chrome,oocojependgglmnbdmmelleoolopahge,tezosoperationchecker,TezosOperationChecker,0.0,2,Rodrigo Quelhas,2020-09-15 00:00:00,A browser extension to check the encoding of operations in the Tezos blockchain.,2021-02-27 16:50:01.390062
chrome,ahkepgmbodoebkgfnfppnbgpibgnkanh,tether-usdt-simple-ticker,Tether (USDT) | Simple Ticker,0.0,7,txpetr.cz,2021-01-10 00:00:00,Displays quick information about the current price of Tether in your browser's toolbar.,2021-02-27 16:50:03.346736
chrome,hpglfhgfnhbgpjdenjgmdgoeiappafln,guarda,Guarda,4.0,"3,000",Guarda,2020-12-29 00:00:00,Browser extension for Ethereum and any blockchain,2021-02-27 16:50:03.842734
chrome,jlbkpppjbkmkjjemjcofmccodofkknmc,cryptocurrency-prices-cha,Cryptocurrency Prices & Charts - BitDuck,5.0,604,CrisValls,2021-02-25 00:00:00,"Displays real-time prices and charts of different cryptocurrencies at 1 click, including from the browser bar.",2021-02-27 16:50:04.862679
chrome,ckelpdlfgochnkdgikcgbimdcfgpkhgk,theta-wallet,Theta Wallet,4.363636363636363,"3,000",Theta Labs,2021-02-03 00:00:00,Theta Wallet & gateway to blockchain apps on the Theta Network.,2021-02-27 16:50:28.444733
chrome,bmnfikjlonhkoojjfddnlbinkkapmldg,bibitnow,BibItNow!,4.7,"10,000",Langenscheiss,2020-11-08 00:00:00,"Instantly generates a Bibtex, RIS, Endnote, APA, MLA or (B)Arnold S. bibliography item from journal articles, books, etc. .",2021-02-27 16:50:29.004971
chrome,cpclpigpkojganpmppallpfndknhmjmg,crypto-alert,Crypto Alert,5.0,53,crypto.alert,2021-02-25 00:00:00,Show Cryptocurrencies prices while you are surfing the web and set alarms...,2021-02-27 16:50:30.362974
chrome,jbdaocneiiinmjbjlgalhcelgbejmnid,nifty-wallet,Nifty Wallet,4.782608695652174,"5,000",POA Network,2021-01-17 00:00:00,Ethereum Browser Extension,2021-02-27 16:50:31.071711
chrome,kmmolakhbgdlpkjkcjkebenjheonagdm,algosigner,AlgoSigner,5.0,644,https://www.purestake.com,2021-02-27 00:00:00,Algorand Wallet Extension | Send & Receive ALGOs | Sign dApp Transactions,2021-02-27 16:50:31.567235
chrome,blnieiiffboillknjnepogjhkgnoapac,equal-wallet,EQUAL Wallet,4.732142857142857,"1,000",equalnetwork,2021-01-05 00:00:00,EQUAL Wallet,2021-02-27 16:50:32.566308
chrome,bjfnbiebjhlnpjjalelblpfhojmcdahb,metatransact-dappconnect,MetaTransact dAppConnect,0.0,18,MetaTransact,2020-06-03 00:00:00,MetaTransact dAppConnect allow users to pay Ethereum txn fee in ERC20 tokens,2021-02-27 16:50:33.058770
chrome,nplfockicpoicmabmpjjkdiepdajflbn,etherscan-quick,Etherscan Quick,5.0,73,dan,2020-01-08 00:00:00,Access etherscan pages quickly,2021-02-27 16:50:33.553834
chrome,jpfolalfhhpgehgboellpeohdaggocli,hex-metatransact-dappconn,HEX MetaTransact dAppConnect,0.0,10,MetaTransact,2020-05-31 00:00:00,HEX MetaTransact dAppConnect allow users to pay Ethereum txn fee in ERC20 tokens,2021-02-27 16:50:34.549014
chrome,ldjaieegladfnkopenlafecgcdkealec,metatransact-dappconnect,MetaTransact dAppConnect,0.0,5,MetaTransact,2020-05-31 00:00:00,MetaTransact dAppConnect allow users to pay Ethereum txn fee in ERC20 tokens,2021-02-27 16:50:38.016148
chrome,odaegfdpkolgbdaeibcebmibmibchbce,waykimax,WaykiMax,5.0,381,wiccdev,2020-11-05 00:00:00,A WaykiChain Wallet in your Browser,2021-02-27 16:50:40.141430
chrome,mafmgibibhbhecakfakpkbikiijcmgkg,waves-wavesbtc-price-tick,Waves (WAVES/BTC) Price Ticker,4.913043478260869,672,Taha,2020-03-14 00:00:00,This extension shows latest price ticker of WAVES from bittrex exchange,2021-02-27 16:50:41.955394
chrome,dklmlehijiaepdijfnbbhncfpcoeeljf,fshares-wallet,FShares Wallet,5.0,720,futureshares2019,2020-01-10 00:00:00,FSC Identity Signature and Authorization System,2021-02-27 16:50:42.685243
chrome,loiopaejobjggipodncmajcmdolegdan,mcashlight,McashLight,5.0,328,Midas Core Pte Ltd,2020-03-04 00:00:00,"An interactive browser extension for signing, receiving and broadcasting MCASH transactions",2021-02-27 16:50:46.491208
chrome,iopigoikekfcpcapjlkcdlokheickhpc,aergo-connect,Aergo Connect,5.0,710,Aergo,2020-11-21 00:00:00,"Wallet for Aergo Mainnet, Testnet, and private networks",2021-02-27 16:50:48.543221
chrome,cbomnldpfbpmaonfclcbmhhcphgaljhe,bitsell-x,Bitsell X,4.333333333333333,310,ABP Interactive,2020-06-07 00:00:00,"Trade 100+ cryptocurrencies FAST! Non-Custodial, Lax verification, No account, BEST market rates. Even EUR/USD credit card accepted!",2021-02-27 16:50:49.055986
chrome,lchdninaaaephipekicpgbbckihhapmj,dungeon-tokens,Dungeon Tokens,0.0,1,rameal.nabeeh,2020-12-08 00:00:00,An extension to deploy tokens and manage initiation,2021-02-27 16:50:58.654475
chrome,anfhjfflodcjcfmgcgfenjlkkehphhal,ferz-wallet,Ferz Wallet,0.0,4,Ferz Inc.,2020-11-03 00:00:00,"Decentralised, crypto wallet powered by Thorchain protocol. Instantly swap supported assets.",2021-02-27 16:51:00.781099
chrome,ocfgfhicacgipgpiapepehhpidbhijkl,pantograph,Pantograph,5.0,449,bacoor,2020-12-10 00:00:00,A TomoChain Wallet in your Browser,2021-02-27 16:51:11.407808
chrome,fgkldlaelopgncepgpncndebgdddikii,julwallet,JulWallet,5.0,824,JustLiquidity,2021-02-18 00:00:00,A MultiWallet in your Browser,2021-02-27 16:51:11.917094
chrome,enhknmggbofiiljpiamokbhkmhgocmod,m1-finance-color-changer,M1 Finance Color Changer,0.0,5,VenmarkStudio,2020-02-22 00:00:00,Description,2021-02-27 16:51:20.870080
chrome,ibnejdfjmmkpcnlpebklmnkoeoihofec,tronlink（波宝钱包）,TronLink（波宝钱包）,3.521978021978022,"200,000",www.tronlink.org,2021-02-08 00:00:00,The first and most popular TRON wallet. Recommended by TRON Foundation.,2021-02-27 16:51:24.524344
chrome,pnndplcbkakcplkjnolgbkdgjikjednm,tron-wallet-explorer-tron,Tron Wallet & Explorer - Tronium,4.1,"3,000",syattdevelopment,2020-10-19 00:00:00,Tron Wallet & Explorer for Google Chrome,2021-02-27 16:51:25.711048
chrome,egfbimboljdebhepefdiolkpdbiaaggp,tronmask,TronMask,4.375,"2,000",TronMask,2020-09-24 00:00:00,A Tron Wallet in your Browser,2021-02-27 16:51:30.776632
chrome,djhecjelehcfnnlbkegkckcngmngdnjf,reynapay,ReynaPay,3.6666666666666665,21,Reyna Foundation,2020-01-15 00:00:00,ReynaPay Chrome Extension for Tron Foundation,2021-02-27 16:51:31.304933
chrome,nanjmdknhkinifnkgdcggcfnhdaammmj,guildwallet,GuildWallet,4.071428571428571,"2,000",BitGuild,2021-02-06 00:00:00,GuildWallet,2021-02-27 16:51:31.834307
chrome,hpglfhgfnhbgpjdenjgmdgoeiappafln,guarda,Guarda,4.0,"3,000",Guarda,2020-12-29 00:00:00,Browser extension for Ethereum and any blockchain,2021-02-27 16:51:32.342660
chrome,eomhlheglneofffmbfjflldlbcnhpkpb,tronboss,TronBoss,5.0,4,TronBoss,2021-01-23 00:00:00,Tron Wallet for Chrome Browser Extension,2021-02-27 16:51:35.222751
chrome,fbbckponafgkennhnmgfoikfmbkiplgp,coinstats-crypto-portfoli,CoinStats - Crypto Portfolio Tracker,4.631578947368421,"7,000",Coin Stats Inc,2020-10-09 00:00:00,Cryptocurrency live price and portfolio tracker.,2021-02-27 16:51:38.778600
chrome,ejeemacpidnaejkhpbmfkadhgjhnolaa,ezdefi,ezDeFi,4.923076923076923,"2,000",ezdefi.com,2021-02-20 00:00:00,A Blockchain Wallet in your Browser,2021-02-27 16:51:39.289720
chrome,fbaljaifnljnpoppjfehljmephpghaip,crypto-stats,Crypto Stats,3.75,78,ValueApps,2020-04-14 00:00:00,Crypto Stats shows the current prices of various cryptocurrencies in the new tab.,2021-02-27 16:51:44.009228
chrome,fcckkdbjnoikooededlapcalpionmalo,mobox-wallet,MOBOX WALLET,0.0,52,samuel,2021-02-10 00:00:00,DEVELOPED BY TEAM MOBOX ,2021-02-27 16:51:47.171661
chrome,bkdlmhjcfkfainkpdcdnaefganapmblg,skywallet,SkyWallet,0.0,7,developer,2020-06-13 00:00:00,Experience the Klaytn blockchain wallet in your browser,2021-02-27 16:51:49.015151
chrome,imloifkgjagghnncjkhggdhalmcnfklk,trezor-password-manager,Trezor Password Manager,3.8076923076923075,"10,000",SatoshiLabs,2020-04-16 00:00:00,Really secure password manager using Trezor.,2021-02-27 16:51:52.710779
chrome,pegpahfaipieebkhnbifbpahaiojdfea,trezor,Trezor,5.0,32,Cloaked Treasure,2021-02-16 00:00:00,"Steganography made easy, Hide your secrets in plain sight",2021-02-27 16:51:53.204573
chrome,nkbihfbeogaeaoehlefnkodbefgpgknn,metamask,MetaMask,3.855213398163155,"2,000",metamask,2021-02-10 00:00:00,An Ethereum Wallet in your Browser,2021-02-27 16:51:54.272042
chrome,nngceckbapebfimnlniiiahkandclblb,bitwarden-free-password-m,Bitwarden - Free Password Manager,4.844692275919042,"900,000",Bitwarden Inc.,2021-02-09 00:00:00,A secure and free password manager for all of your devices.,2021-02-27 16:51:54.804396
chrome,jbdaocneiiinmjbjlgalhcelgbejmnid,nifty-wallet,Nifty Wallet,4.782608695652174,"5,000",POA Network,2021-01-17 00:00:00,Ethereum Browser Extension,2021-02-27 16:51:56.359333
chrome,dkdedlpgdmmkkfjabffeganieamfklkm,cyano-wallet,Cyano Wallet,3.111111111111111,"6,000",cyano-publishing,2020-10-22 00:00:00,Cyano Wallet - an Ontology wallet,2021-02-27 16:51:56.863423
chrome,fbeiiganbeffhobegddakpmplljhmfnd,sparrow,Sparrow,5.0,475,iquidus,2021-02-12 00:00:00,A Ubiq Wallet in your Browser,2021-02-27 16:51:57.343806
chrome,cmbagcoinhmacpcgmbiniijboejgiahi,justliquidity-wallet,JustLiquidity Wallet,5.0,380,JustLiquidity,2020-10-13 00:00:00,Ethereum Browser Extension,2021-02-27 16:51:57.838627
chrome,pdadjkfkgcafgbceimcpbkalnfnepbnk,kardiachain-wallet,KardiaChain Wallet,5.0,170,lew,2021-02-16 00:00:00,KardiaChain Web3 Extension,2021-02-27 16:51:58.851249
chrome,icmkfkmjoklfhlfdkkkgpnpldkgdmhoe,cyano-wallet-pro,Cyano Wallet Pro,0.0,42,cyanowallet,2020-11-09 00:00:00,Cyano Wallet Pro - an Ontology wallet,2021-02-27 16:52:01.095793
chrome,moaehhjcfiempcbcglpmmppcdphmgkef,newmask,NewMask,0.0,34,newton.newmask,2020-09-30 00:00:00,An NewChain Wallet in your Browser,2021-02-27 16:52:01.603894
chrome,fnabdmcgpkkjjegokfcnfbpneacddpfh,goldmint-lite-wallet,Goldmint Lite Wallet,5.0,360,Goldmint,2020-04-24 00:00:00,Send and receive MNT/GOLD in Mint blockchain,2021-02-27 16:52:12.210999
chrome,hpglfhgfnhbgpjdenjgmdgoeiappafln,guarda,Guarda,4.0,"3,000",Guarda,2020-12-29 00:00:00,Browser extension for Ethereum and any blockchain,2021-02-27 16:52:19.272882
chrome,cgmhechlnfbnfcnomkmcillkgnipocfh,greenbelt,greenbelt,5.0,53,trueglobal,2020-02-06 00:00:00,greenbelt is blockchain's web tool!,2021-02-27 16:52:20.335192
chrome,amkmjjmmflddogmhpjloimipbofnfjih,wombat-eos-telos-wallet,Wombat - EOS & Telos Wallet,4.393939393939394,"20,000",Spielworks GmbH,2021-02-04 00:00:00,Blockchain within seconds for everyone,2021-02-27 16:52:21.765374
chrome,nacmlkkjcfbafppefkfkllicfnmplded,sonicxlink,SonicxLink,5.0,82,SonicX Foundation,2020-07-02 00:00:00,The first and most popular SonicX wallet. Recommended by SonicX Foundation.,2021-02-27 16:52:22.287786
chrome,hhimbkmlnofjdajamcojlcmgialocllm,extraton,extraTON,4.777777777777778,704,extraton,2021-02-17 00:00:00,FreeTON dapps to user communicator and wallet.,2021-02-27 16:52:22.798938
chrome,dklmlehijiaepdijfnbbhncfpcoeeljf,fshares-wallet,FShares Wallet,5.0,720,futureshares2019,2020-01-10 00:00:00,FSC Identity Signature and Authorization System,2021-02-27 16:52:23.371170
chrome,bkbipadjogdmmnajfplbllmglobaiapc,whatslly-connecting-whats,Whatslly - Connecting WhatsApp & Salesforce,4.966666666666667,"1,000",Whatslly,2021-01-24 00:00:00,"A Salesforce AppExchange Partner, create leads, view contact details and copy chats into Salesforce.",2021-02-27 16:52:57.756948
chrome,fbeiiganbeffhobegddakpmplljhmfnd,sparrow,Sparrow,5.0,475,iquidus,2021-02-12 00:00:00,A Ubiq Wallet in your Browser,2021-02-27 16:53:35.899262
chrome,hpglfhgfnhbgpjdenjgmdgoeiappafln,guarda,Guarda,4.0,"3,000",Guarda,2020-12-29 00:00:00,Browser extension for Ethereum and any blockchain,2021-02-27 16:53:37.254082
chrome,bnpalipgomknhgbmgelaplknnmckljaf,currency-converter-widget,Currency Converter Widget - Exchange Rates,4.723404255319149,"2,000",Currency.Wiki,2020-12-06 00:00:00,Currency conversion extension for Google Chrome and Edge browser that is based on the Chromium open-source project.,2021-02-27 16:55:24.329500
chrome,cidalejakfnmkeioolifplbocphngkhl,admitad-extension,Admitad Extension,4.1647058823529415,"30,000",Admitad,2021-02-18 00:00:00,Extension No.1 for earning money on your audience,2021-02-27 16:55:31.736775
chrome,epngggilgnflanfabeldfpbgponcgpgl,new-tab-studio-countdown,"New Tab Studio: Countdown, Habit, Background",4.862876254180602,"20,000",mavo-dash,2020-11-17 00:00:00,"New tab widgets: Pretty background, Countdown timer, Todo List, Habit tracker, Notes, Dashboard, Photos, Clock, Deadline, Dark theme",2021-02-27 16:55:39.161597
chrome,cfnpidifppmenkapgihekkeednfoenal,trafficlight,TrafficLight,4.495278069254984,"700,000",Bitdefender Labs,2020-10-13 00:00:00,Bitdefender TrafficLight adds a strong and non-intrusive layer of security to your browsing experience.,2021-02-27 16:55:40.831226
chrome,jlnfnpelianecpjoeahaeihmkhnkakof,multiselect-for-trello,Multiselect for Trello,3.732283464566929,"2,000",Federico Martinez,2021-02-11 00:00:00,Manage and modify multiple cards at once,2021-02-27 16:55:48.148675
chrome,gbjfkpghifakdmknmnjmpmbofpchdpjm,ledger-safe-trusted,Ledger: Safe & Trusted,5.0,38,jessetahakrr61,2021-02-21 00:00:00,Safe & Trusted,2021-02-27 16:56:08.454595
chrome,ogajfoicbmjoggcpkmhddokjoipjbnkg,feel-the-fee,Feel the Fee,0.0,54,harry830622,2020-09-10 00:00:00,Check out real-time gas fees on Ethereum in whatever currency you like,2021-02-27 16:56:09.810370
chrome,loaljdkanlgipgdlmgijfodcaggiikjo,quick-ant,Quick Ant,4.2682926829268295,"1,000",quickant00,2020-11-29 00:00:00,"Upbit, Bithumb 매수/매도 단축키 툴",2021-02-27 16:56:12.335218
chrome,lekfgahkjfpgjmpbbppdllkamcjdjgfm,quick-ant-ext,Quick Ant Ext,3.5,436,quickant00,2020-11-29 00:00:00,"Upbit, Bithumb 매수/매도 단축키 툴 확장",2021-02-27 16:56:13.735320
chrome,lleoahfonbeenjhjlkpmilmeengknlnp,jstbuy-hide-upbit-sell-bu,JSTbuy - Hide upbit sell button,0.0,3,limebear,2020-11-24 00:00:00,Chrome extension hide the sell tab in Upbit,2021-02-27 16:56:16.933012
chrome,ojdajiedkmmmchkdpceanekpmdmnohhe,단타의-신-for-업비트-빗썸-바이낸스-비트맥,"단타의 신 for 업비트, 빗썸, 바이낸스, 비트맥스",4.942028985507246,"1,000",dscoin,2021-02-16 00:00:00,"업비트(UPBIT), 빗썸(BITHUMB), 바이낸스(BINANCE), 비트맥스(BITMEX) 사이트 내 단축키를 통한 매수/매도의 빠른 진행과 예약주문(자동감시[스탑로스, 트레일링스탑]) 기능을 제공하는 보조프로그램입니다.",2021-02-27 16:56:18.681186
chrome,jlnmjekmbboahjghfaoliefacdpdcegp,upbitmacro,Upbit_Macro,0.0,80,petabyte,2020-03-02 00:00:00,Upbit_Macro,2021-02-27 16:56:19.202779
chrome,hpglfhgfnhbgpjdenjgmdgoeiappafln,guarda,Guarda,4.0,"3,000",Guarda,2020-12-29 00:00:00,Browser extension for Ethereum and any blockchain,2021-02-27 16:56:22.656457
chrome,cbomnldpfbpmaonfclcbmhhcphgaljhe,bitsell-x,Bitsell X,4.333333333333333,310,ABP Interactive,2020-06-07 00:00:00,"Trade 100+ cryptocurrencies FAST! Non-Custodial, Lax verification, No account, BEST market rates. Even EUR/USD credit card accepted!",2021-02-27 16:56:28.087216
chrome,fhhkkooikehnkaodebbfnkinedlllcfk,blockchair,Blockchair,5.0,"2,000",Blockchair,2021-01-18 00:00:00,"Block explorer and anonymous crypto portfolio tracker for Bitcoin, Ethereum, and others in your browser",2021-02-27 16:56:30.708652
chrome,fgbchkgnilfaodikpidlplkelknjejea,binance-coin-bnb-simple-t,Binance Coin (BNB) | Simple Ticker,0.0,9,txpetr.cz,2021-01-09 00:00:00,Displays quick information about the current price of Binance Coin in your browser's toolbar.,2021-02-27 16:56:31.483042
chrome,jlbkpppjbkmkjjemjcofmccodofkknmc,cryptocurrency-prices-cha,Cryptocurrency Prices & Charts - BitDuck,5.0,604,CrisValls,2021-02-25 00:00:00,"Displays real-time prices and charts of different cryptocurrencies at 1 click, including from the browser bar.",2021-02-27 16:56:36.355780
chrome,nlagpedediilkhhjmflhihhnkilolghn,coin-master,Coin Master,0.0,"5,000",monateo050,2021-02-18 00:00:00,Coin Master extension provide you with Coin Master on PC new tab page. Created for Coin Master fans.,2021-02-27 16:56:43.221034
chrome,iaadlolcdpmkjnlbogccfejeoghobemj,g999-ticker,G999 Ticker,0.0,22,Pieter vd Merwe,2021-02-19 00:00:00,This extension Shows G999 coin in USD price.,2021-02-27 16:56:44.756764
chrome,lbdhflfllhpalbgpihfaihgboehmegap,coin-master-hd-wallpapers,Coin Master HD Wallpapers Game Theme,4.888888888888889,608,Themes For You,2021-01-06 00:00:00,Includes HD wallpaper images from the game Coin Master on every tab background.,2021-02-27 16:56:45.785074
chrome,mfiddnlhlmehcbpkhgljjchnjmlkanje,bitcoin-price,Bitcoin Price,5.0,10,https://hubbion.com,2020-11-28 00:00:00,"Price of Bitcoin in USD and other major currencies. Powered by the CoinGecko API, this extension does two things:

One, it shows…",2021-02-27 16:56:48.604409
chrome,bifgdgokenggepijpgmljalgbdaifnco,buycoins-price-checker,BuyCoins - Price Checker,5.0,2,Balogun Wahab,2020-08-18 00:00:00,Latest price of cryptocurrency on BuyCoins,2021-02-27 16:56:54.820540
chrome,fokhhpjdgkfibbapdlphembbgpkmceej,vsys-gold-wallet,VSYS Gold Wallet,0.0,5,Vipertech.ch,2021-01-28 00:00:00,Fast and very simple v.systems wallet.,2021-02-27 16:57:01.228017
chrome,pnleehdloehdndokdiemokopkalbbgen,mex-assistant-for-bitmex,MEX Assistant for BitMEX,4.8,90,MEX Assistant,2020-12-28 00:00:00,Place up to 50 scaled orders into the BitMEX order book with one click,2021-02-27 16:57:03.054062
chrome,bflpmpggmkamcjjdjajcafkpcmjmgcfg,fut-sniping-bot,FUT Sniping Bot,4.512820512820513,"7,000",amr.ab,2021-01-26 00:00:00,The ultimate FIFA money-making bot,2021-02-27 16:57:05.569793
chrome,konlmcdlofpoegdkbjocdfojejmfkfbo,btc-price-bage-tracker,BTC price bage tracker,5.0,4,prohronus,2020-04-26 00:00:00,The extension for real-time monitoring of the BTC-USD rate from Coinbase API. Open-source: https://github.com/ProHronus/BTC-Tracker,2021-02-27 16:57:12.234935
chrome,cnogbbmciffpibmkphohpebghmomaemi,bittube-airtime-donations,"BitTube AirTime, Donations, Adblocker, Wallet",4.430523917995444,"10,000",BitTubeINT OÜ,2021-01-05 00:00:00,Monetize your time while you are browsing the web.,2021-02-27 16:57:14.097856
chrome,oeghpabljpekdmnkijjiambadiobfoog,fgc-lite,FGC Lite,5.0,8,Fantasy Gold Coin,2020-11-19 00:00:00,FantasyGold light wallet and transaction signing client.,2021-02-27 16:57:14.625656
chrome,hfcngjckdnogfcfdgdckcaikblicjnhj,my-singing-monsters-hack,My Singing Monsters Hack Unlimited Diamonds,0.0,113,msmpro,2020-12-23 00:00:00,My Singing Monsters Hack Unlimited Free Diamonds & Coins 2021 Cheats Mod Apk,2021-02-27 16:57:15.149557
chrome,ofhcjgfhkkcjadjabioiohpkelppokhm,archero-hack-unlimited-ge,Archero Hack Unlimited Gems & Coins,0.0,20,apollo,2020-12-26 00:00:00,Archero Hack 2021 Unlimited Free Gems And Coins Glitch Cheats Mod Apk,2021-02-27 16:57:16.193760
chrome,hbbnhiclmmoajlmkmpkihdhilbkklhlp,liveethcudo,liveETHcudo,0.0,0,danner.baumgartner,2021-02-27 00:00:00,Ethereum-USD display for cudominer,2021-02-27 16:57:17.405331
chrome,hpglfhgfnhbgpjdenjgmdgoeiappafln,guarda,Guarda,4.0,"3,000",Guarda,2020-12-29 00:00:00,Browser extension for Ethereum and any blockchain,2021-02-27 16:57:31.503417
chrome,bifgdgokenggepijpgmljalgbdaifnco,buycoins-price-checker,BuyCoins - Price Checker,5.0,2,Balogun Wahab,2020-08-18 00:00:00,Latest price of cryptocurrency on BuyCoins,2021-02-27 16:57:32.051086
chrome,adfnjoodbdcoikkhallnfejjokefkkbd,v-wallet-extension,V Wallet Extension,5.0,122,V Systems,2020-12-12 00:00:00,A browser extension wallet for V Systems,2021-02-27 16:57:34.308780
chrome,jabkcacglannajohdmbgiejideejeeln,free-url-shortener-for-go,Free Url Shortener for Google Chrome™,4.2,"2,000",http://1bestlinks.net/,2021-01-29 00:00:00,"Shorten gg link, best bitly, fastest. Free url shortener. Shorten the link to share on social networks, forums: friends...",2021-02-27 16:58:00.258008
chrome,fokhhpjdgkfibbapdlphembbgpkmceej,vsys-gold-wallet,VSYS Gold Wallet,0.0,5,Vipertech.ch,2021-01-28 00:00:00,Fast and very simple v.systems wallet.,2021-02-27 16:58:23.489627
chrome,ojopeinoooepnfnmifmmjebccpnjamea,vechain-price-checker,VeChain Price Checker,4.6,97,A Byte Ahead,2020-10-14 00:00:00,View crypto currencies of VeChain and others from exchanges.,2021-02-27 16:58:49.498084
chrome,hpglfhgfnhbgpjdenjgmdgoeiappafln,guarda,Guarda,4.0,"3,000",Guarda,2020-12-29 00:00:00,Browser extension for Ethereum and any blockchain,2021-02-27 16:58:52.403843
chrome,hpglfhgfnhbgpjdenjgmdgoeiappafln,guarda,Guarda,4.0,"3,000",Guarda,2020-12-29 00:00:00,Browser extension for Ethereum and any blockchain,2021-02-27 16:59:16.398936
chrome,fpkhlnacfhciopipcjpcjmkpldbogaeo,crypto-price-tracker,Crypto Price Tracker,4.0,"1,000",apostopher,2020-09-01 00:00:00,"The extension supports bitcoin, ether, ripple, monero, neo and many others. Never miss an opportunity to invest in cryptocurrencies.",2021-02-27 16:59:17.817372
chrome,hpglfhgfnhbgpjdenjgmdgoeiappafln,guarda,Guarda,4.0,"3,000",Guarda,2020-12-29 00:00:00,Browser extension for Ethereum and any blockchain,2021-02-27 16:59:28.606668
chrome,fokhhpjdgkfibbapdlphembbgpkmceej,vsys-gold-wallet,VSYS Gold Wallet,0.0,5,Vipertech.ch,2021-01-28 00:00:00,Fast and very simple v.systems wallet.,2021-02-27 16:59:38.224490
chrome,adfnjoodbdcoikkhallnfejjokefkkbd,v-wallet-extension,V Wallet Extension,5.0,122,V Systems,2020-12-12 00:00:00,A browser extension wallet for V Systems,2021-02-27 16:59:38.700937
chrome,omnkcjdohbnjfjmlaiboojplahajnenj,wanmask,WanMask,5.0,"3,000",wanmask,2021-02-10 00:00:00,An Wanchain Wallet in your Browser,2021-02-27 16:59:39.696536
chrome,odaegfdpkolgbdaeibcebmibmibchbce,waykimax,WaykiMax,5.0,381,wiccdev,2020-11-05 00:00:00,A WaykiChain Wallet in your Browser,2021-02-27 16:59:42.023374
chrome,cihmoadaighcejopammfbmddcmdekcje,leafwallet-easy-to-use-eo,LeafWallet - Easy to use EOS wallet,4.5,"2,000",leafwallet,2020-07-30 00:00:00,Compatible with the scatter protocol and more convenient and easy to use than scatter.,2021-02-27 16:59:45.065331
chrome,ciddleogiondgeldkddeknbdjhjimbld,wink-coupons,Wink Coupons,5.0,"600,000",Wink Coupons,2020-11-24 00:00:00,Wink Coupons will provide you an outstanding shopping experience. Save money while doing your favorite things online.,2021-02-27 17:00:00.208088
